{
  "address": "0x1e86fCe4d102A5924A9EF503f772fCA162Af2067",
  "abi": [
    {
      "inputs": [
        {
          "internalType": "address",
          "name": "_WNATIVE",
          "type": "address"
        }
      ],
      "stateMutability": "nonpayable",
      "type": "constructor"
    },
    {
      "anonymous": false,
      "inputs": [
        {
          "indexed": true,
          "internalType": "address",
          "name": "previousOwner",
          "type": "address"
        },
        {
          "indexed": true,
          "internalType": "address",
          "name": "newOwner",
          "type": "address"
        }
      ],
      "name": "OwnershipTransferred",
      "type": "event"
    },
    {
      "inputs": [
        {
          "internalType": "address",
          "name": "_from",
          "type": "address"
        },
        {
          "internalType": "address",
          "name": "_to",
          "type": "address"
        },
        {
          "internalType": "address",
          "name": "_router",
          "type": "address"
        },
        {
          "internalType": "uint256",
          "name": "_amt",
          "type": "uint256"
        }
      ],
      "name": "estimateZapInToken",
      "outputs": [
        {
          "internalType": "uint256",
          "name": "",
          "type": "uint256"
        },
        {
          "internalType": "uint256",
          "name": "",
          "type": "uint256"
        }
      ],
      "stateMutability": "view",
      "type": "function"
    },
    {
      "inputs": [
        {
          "internalType": "address",
          "name": "",
          "type": "address"
        }
      ],
      "name": "isFeeOnTransfer",
      "outputs": [
        {
          "internalType": "bool",
          "name": "",
          "type": "bool"
        }
      ],
      "stateMutability": "view",
      "type": "function"
    },
    {
      "inputs": [],
      "name": "owner",
      "outputs": [
        {
          "internalType": "address",
          "name": "",
          "type": "address"
        }
      ],
      "stateMutability": "view",
      "type": "function"
    },
    {
      "inputs": [],
      "name": "renounceOwnership",
      "outputs": [],
      "stateMutability": "nonpayable",
      "type": "function"
    },
    {
      "inputs": [
        {
          "internalType": "address",
          "name": "token",
          "type": "address"
        }
      ],
      "name": "setIsFeeOnTransfer",
      "outputs": [],
      "stateMutability": "nonpayable",
      "type": "function"
    },
    {
      "inputs": [
        {
          "internalType": "address",
          "name": "token",
          "type": "address"
        },
        {
          "internalType": "address",
          "name": "router",
          "type": "address"
        },
        {
          "internalType": "address",
          "name": "bridgeToken",
          "type": "address"
        }
      ],
      "name": "setTokenBridgeForRouter",
      "outputs": [],
      "stateMutability": "nonpayable",
      "type": "function"
    },
    {
      "inputs": [
        {
          "internalType": "address",
          "name": "router",
          "type": "address"
        }
      ],
      "name": "setUseNativeRouter",
      "outputs": [],
      "stateMutability": "nonpayable",
      "type": "function"
    },
    {
      "inputs": [
        {
          "internalType": "address",
          "name": "_from",
          "type": "address"
        },
        {
          "internalType": "uint256",
          "name": "amount",
          "type": "uint256"
        },
        {
          "internalType": "address",
          "name": "routerAddr",
          "type": "address"
        },
        {
          "internalType": "address",
          "name": "_recipient",
          "type": "address"
        }
      ],
      "name": "swapToNative",
      "outputs": [],
      "stateMutability": "nonpayable",
      "type": "function"
    },
    {
      "inputs": [
        {
          "internalType": "address",
          "name": "_from",
          "type": "address"
        },
        {
          "internalType": "uint256",
          "name": "amount",
          "type": "uint256"
        },
        {
          "internalType": "address",
          "name": "_to",
          "type": "address"
        },
        {
          "internalType": "address",
          "name": "routerAddr",
          "type": "address"
        },
        {
          "internalType": "address",
          "name": "_recipient",
          "type": "address"
        }
      ],
      "name": "swapToken",
      "outputs": [],
      "stateMutability": "nonpayable",
      "type": "function"
    },
    {
      "inputs": [
        {
          "internalType": "address",
          "name": "newOwner",
          "type": "address"
        }
      ],
      "name": "transferOwnership",
      "outputs": [],
      "stateMutability": "nonpayable",
      "type": "function"
    },
    {
      "inputs": [
        {
          "internalType": "address",
          "name": "",
          "type": "address"
        }
      ],
      "name": "useNativeRouter",
      "outputs": [
        {
          "internalType": "bool",
          "name": "",
          "type": "bool"
        }
      ],
      "stateMutability": "view",
      "type": "function"
    },
    {
      "inputs": [
        {
          "internalType": "address",
          "name": "token",
          "type": "address"
        }
      ],
      "name": "withdraw",
      "outputs": [],
      "stateMutability": "nonpayable",
      "type": "function"
    },
    {
      "inputs": [
        {
          "internalType": "address",
          "name": "_from",
          "type": "address"
        },
        {
          "internalType": "uint256",
          "name": "amount",
          "type": "uint256"
        },
        {
          "internalType": "address",
          "name": "_toRouter",
          "type": "address"
        },
        {
          "internalType": "address",
          "name": "_recipient",
          "type": "address"
        }
      ],
      "name": "zapAcross",
      "outputs": [],
      "stateMutability": "nonpayable",
      "type": "function"
    },
    {
      "inputs": [
        {
          "internalType": "address",
          "name": "_to",
          "type": "address"
        },
        {
          "internalType": "address",
          "name": "routerAddr",
          "type": "address"
        },
        {
          "internalType": "address",
          "name": "_recipient",
          "type": "address"
        }
      ],
      "name": "zapIn",
      "outputs": [],
      "stateMutability": "payable",
      "type": "function"
    },
    {
      "inputs": [
        {
          "internalType": "address",
          "name": "_from",
          "type": "address"
        },
        {
          "internalType": "uint256",
          "name": "amount",
          "type": "uint256"
        },
        {
          "internalType": "address",
          "name": "_to",
          "type": "address"
        },
        {
          "internalType": "address",
          "name": "routerAddr",
          "type": "address"
        },
        {
          "internalType": "address",
          "name": "_recipient",
          "type": "address"
        }
      ],
      "name": "zapInToken",
      "outputs": [],
      "stateMutability": "nonpayable",
      "type": "function"
    },
    {
      "inputs": [
        {
          "internalType": "address",
          "name": "_from",
          "type": "address"
        },
        {
          "internalType": "uint256",
          "name": "amount",
          "type": "uint256"
        },
        {
          "internalType": "address",
          "name": "routerAddr",
          "type": "address"
        },
        {
          "internalType": "address",
          "name": "_recipient",
          "type": "address"
        }
      ],
      "name": "zapOut",
      "outputs": [],
      "stateMutability": "nonpayable",
      "type": "function"
    },
    {
      "inputs": [
        {
          "internalType": "address",
          "name": "_from",
          "type": "address"
        },
        {
          "internalType": "uint256",
          "name": "amount",
          "type": "uint256"
        },
        {
          "internalType": "address",
          "name": "_to",
          "type": "address"
        },
        {
          "internalType": "address",
          "name": "routerAddr",
          "type": "address"
        },
        {
          "internalType": "address",
          "name": "_recipient",
          "type": "address"
        }
      ],
      "name": "zapOutToken",
      "outputs": [],
      "stateMutability": "nonpayable",
      "type": "function"
    },
    {
      "stateMutability": "payable",
      "type": "receive"
    }
  ],
  "transactionHash": "0xe4b605cd9fee656f77c43c6b1eb97469632d67685d6323292b31da905fef9854",
  "receipt": {
    "to": null,
    "from": "0xf39Fd6e51aad88F6F4ce6aB8827279cffFb92266",
    "contractAddress": "0x1e86fCe4d102A5924A9EF503f772fCA162Af2067",
    "transactionIndex": 0,
    "gasUsed": "3649409",
    "logsBloom": "0x00000000000000000000000000000000000000000000000000800000000000000000000000000000000000000000000000000000000200000000000000000000000000000000000000000000000000000001000000000000000000000000000000000200020000000000000100000800000000000000000000000000000000400000000000000000000000000000000000000000000000000000000000000000000000000000000000000000000000000000000000000000000000000000000000000000000000200000000000000000010000002000000000000000000020000000000000000000000000000000000000000000000000000000000000000000",
    "blockHash": "0x3465ce74bd808f6ef3cec9409edf0395c9c96bd9db8a15d733c83a5e5511f5a0",
    "transactionHash": "0xe4b605cd9fee656f77c43c6b1eb97469632d67685d6323292b31da905fef9854",
    "logs": [
      {
        "transactionIndex": 0,
        "blockNumber": 5234078,
        "transactionHash": "0xe4b605cd9fee656f77c43c6b1eb97469632d67685d6323292b31da905fef9854",
        "address": "0x1e86fCe4d102A5924A9EF503f772fCA162Af2067",
        "topics": [
          "0x8be0079c531659141344cd1fd0a4f28419497f9722a3daafe3b4186f6b6457e0",
          "0x0000000000000000000000000000000000000000000000000000000000000000",
          "0x000000000000000000000000f39fd6e51aad88f6f4ce6ab8827279cfffb92266"
        ],
        "data": "0x",
        "logIndex": 0,
        "blockHash": "0x3465ce74bd808f6ef3cec9409edf0395c9c96bd9db8a15d733c83a5e5511f5a0"
      }
    ],
    "blockNumber": 5234078,
    "cumulativeGasUsed": "3649409",
    "status": 1,
    "byzantium": true
  },
  "args": [
    "0x6D02ABC5fa967B0b085083F5Cf36c24502447244"
  ],
  "numDeployments": 1,
  "solcInputHash": "f77d36897e3ec85e8f1aed5cd075e017",
  "metadata": "{\"compiler\":{\"version\":\"0.8.17+commit.8df45f5f\"},\"language\":\"Solidity\",\"output\":{\"abi\":[{\"inputs\":[{\"internalType\":\"address\",\"name\":\"_WNATIVE\",\"type\":\"address\"}],\"stateMutability\":\"nonpayable\",\"type\":\"constructor\"},{\"anonymous\":false,\"inputs\":[{\"indexed\":true,\"internalType\":\"address\",\"name\":\"previousOwner\",\"type\":\"address\"},{\"indexed\":true,\"internalType\":\"address\",\"name\":\"newOwner\",\"type\":\"address\"}],\"name\":\"OwnershipTransferred\",\"type\":\"event\"},{\"inputs\":[{\"internalType\":\"address\",\"name\":\"_from\",\"type\":\"address\"},{\"internalType\":\"address\",\"name\":\"_to\",\"type\":\"address\"},{\"internalType\":\"address\",\"name\":\"_router\",\"type\":\"address\"},{\"internalType\":\"uint256\",\"name\":\"_amt\",\"type\":\"uint256\"}],\"name\":\"estimateZapInToken\",\"outputs\":[{\"internalType\":\"uint256\",\"name\":\"\",\"type\":\"uint256\"},{\"internalType\":\"uint256\",\"name\":\"\",\"type\":\"uint256\"}],\"stateMutability\":\"view\",\"type\":\"function\"},{\"inputs\":[{\"internalType\":\"address\",\"name\":\"\",\"type\":\"address\"}],\"name\":\"isFeeOnTransfer\",\"outputs\":[{\"internalType\":\"bool\",\"name\":\"\",\"type\":\"bool\"}],\"stateMutability\":\"view\",\"type\":\"function\"},{\"inputs\":[],\"name\":\"owner\",\"outputs\":[{\"internalType\":\"address\",\"name\":\"\",\"type\":\"address\"}],\"stateMutability\":\"view\",\"type\":\"function\"},{\"inputs\":[],\"name\":\"renounceOwnership\",\"outputs\":[],\"stateMutability\":\"nonpayable\",\"type\":\"function\"},{\"inputs\":[{\"internalType\":\"address\",\"name\":\"token\",\"type\":\"address\"}],\"name\":\"setIsFeeOnTransfer\",\"outputs\":[],\"stateMutability\":\"nonpayable\",\"type\":\"function\"},{\"inputs\":[{\"internalType\":\"address\",\"name\":\"token\",\"type\":\"address\"},{\"internalType\":\"address\",\"name\":\"router\",\"type\":\"address\"},{\"internalType\":\"address\",\"name\":\"bridgeToken\",\"type\":\"address\"}],\"name\":\"setTokenBridgeForRouter\",\"outputs\":[],\"stateMutability\":\"nonpayable\",\"type\":\"function\"},{\"inputs\":[{\"internalType\":\"address\",\"name\":\"router\",\"type\":\"address\"}],\"name\":\"setUseNativeRouter\",\"outputs\":[],\"stateMutability\":\"nonpayable\",\"type\":\"function\"},{\"inputs\":[{\"internalType\":\"address\",\"name\":\"_from\",\"type\":\"address\"},{\"internalType\":\"uint256\",\"name\":\"amount\",\"type\":\"uint256\"},{\"internalType\":\"address\",\"name\":\"routerAddr\",\"type\":\"address\"},{\"internalType\":\"address\",\"name\":\"_recipient\",\"type\":\"address\"}],\"name\":\"swapToNative\",\"outputs\":[],\"stateMutability\":\"nonpayable\",\"type\":\"function\"},{\"inputs\":[{\"internalType\":\"address\",\"name\":\"_from\",\"type\":\"address\"},{\"internalType\":\"uint256\",\"name\":\"amount\",\"type\":\"uint256\"},{\"internalType\":\"address\",\"name\":\"_to\",\"type\":\"address\"},{\"internalType\":\"address\",\"name\":\"routerAddr\",\"type\":\"address\"},{\"internalType\":\"address\",\"name\":\"_recipient\",\"type\":\"address\"}],\"name\":\"swapToken\",\"outputs\":[],\"stateMutability\":\"nonpayable\",\"type\":\"function\"},{\"inputs\":[{\"internalType\":\"address\",\"name\":\"newOwner\",\"type\":\"address\"}],\"name\":\"transferOwnership\",\"outputs\":[],\"stateMutability\":\"nonpayable\",\"type\":\"function\"},{\"inputs\":[{\"internalType\":\"address\",\"name\":\"\",\"type\":\"address\"}],\"name\":\"useNativeRouter\",\"outputs\":[{\"internalType\":\"bool\",\"name\":\"\",\"type\":\"bool\"}],\"stateMutability\":\"view\",\"type\":\"function\"},{\"inputs\":[{\"internalType\":\"address\",\"name\":\"token\",\"type\":\"address\"}],\"name\":\"withdraw\",\"outputs\":[],\"stateMutability\":\"nonpayable\",\"type\":\"function\"},{\"inputs\":[{\"internalType\":\"address\",\"name\":\"_from\",\"type\":\"address\"},{\"internalType\":\"uint256\",\"name\":\"amount\",\"type\":\"uint256\"},{\"internalType\":\"address\",\"name\":\"_toRouter\",\"type\":\"address\"},{\"internalType\":\"address\",\"name\":\"_recipient\",\"type\":\"address\"}],\"name\":\"zapAcross\",\"outputs\":[],\"stateMutability\":\"nonpayable\",\"type\":\"function\"},{\"inputs\":[{\"internalType\":\"address\",\"name\":\"_to\",\"type\":\"address\"},{\"internalType\":\"address\",\"name\":\"routerAddr\",\"type\":\"address\"},{\"internalType\":\"address\",\"name\":\"_recipient\",\"type\":\"address\"}],\"name\":\"zapIn\",\"outputs\":[],\"stateMutability\":\"payable\",\"type\":\"function\"},{\"inputs\":[{\"internalType\":\"address\",\"name\":\"_from\",\"type\":\"address\"},{\"internalType\":\"uint256\",\"name\":\"amount\",\"type\":\"uint256\"},{\"internalType\":\"address\",\"name\":\"_to\",\"type\":\"address\"},{\"internalType\":\"address\",\"name\":\"routerAddr\",\"type\":\"address\"},{\"internalType\":\"address\",\"name\":\"_recipient\",\"type\":\"address\"}],\"name\":\"zapInToken\",\"outputs\":[],\"stateMutability\":\"nonpayable\",\"type\":\"function\"},{\"inputs\":[{\"internalType\":\"address\",\"name\":\"_from\",\"type\":\"address\"},{\"internalType\":\"uint256\",\"name\":\"amount\",\"type\":\"uint256\"},{\"internalType\":\"address\",\"name\":\"routerAddr\",\"type\":\"address\"},{\"internalType\":\"address\",\"name\":\"_recipient\",\"type\":\"address\"}],\"name\":\"zapOut\",\"outputs\":[],\"stateMutability\":\"nonpayable\",\"type\":\"function\"},{\"inputs\":[{\"internalType\":\"address\",\"name\":\"_from\",\"type\":\"address\"},{\"internalType\":\"uint256\",\"name\":\"amount\",\"type\":\"uint256\"},{\"internalType\":\"address\",\"name\":\"_to\",\"type\":\"address\"},{\"internalType\":\"address\",\"name\":\"routerAddr\",\"type\":\"address\"},{\"internalType\":\"address\",\"name\":\"_recipient\",\"type\":\"address\"}],\"name\":\"zapOutToken\",\"outputs\":[],\"stateMutability\":\"nonpayable\",\"type\":\"function\"},{\"stateMutability\":\"payable\",\"type\":\"receive\"}],\"devdoc\":{\"kind\":\"dev\",\"methods\":{\"owner()\":{\"details\":\"Returns the address of the current owner.\"},\"renounceOwnership()\":{\"details\":\"Leaves the contract without owner. It will not be possible to call `onlyOwner` functions anymore. Can only be called by the current owner. NOTE: Renouncing ownership will leave the contract without an owner, thereby removing any functionality that is only available to the owner.\"},\"transferOwnership(address)\":{\"details\":\"Transfers ownership of the contract to a new account (`newOwner`). Can only be called by the current owner.\"}},\"version\":1},\"userdoc\":{\"kind\":\"user\",\"methods\":{},\"version\":1}},\"settings\":{\"compilationTarget\":{\"contracts/Zap.sol\":\"Zap\"},\"evmVersion\":\"london\",\"libraries\":{},\"metadata\":{\"bytecodeHash\":\"ipfs\",\"useLiteralContent\":true},\"optimizer\":{\"enabled\":true,\"runs\":1000},\"remappings\":[]},\"sources\":{\"contracts/Zap.sol\":{\"content\":\"// SPDX-License-Identifier: MIT\\n\\npragma solidity ^0.8.7;\\n\\n// Part: IHyperswapRouter01\\n\\ninterface IHyperswapRouter01 {\\n    function factory() external pure returns (address);\\n\\n    function WFTM() external pure returns (address);\\n\\n    function addLiquidity(\\n        address tokenA,\\n        address tokenB,\\n        uint256 amountADesired,\\n        uint256 amountBDesired,\\n        uint256 amountAMin,\\n        uint256 amountBMin,\\n        address to,\\n        uint256 deadline\\n    )\\n        external\\n        returns (\\n            uint256 amountA,\\n            uint256 amountB,\\n            uint256 liquidity\\n        );\\n\\n    function addLiquidityFTM(\\n        address token,\\n        uint256 amountTokenDesired,\\n        uint256 amountTokenMin,\\n        uint256 amountFTMMin,\\n        address to,\\n        uint256 deadline\\n    )\\n        external\\n        payable\\n        returns (\\n            uint256 amountToken,\\n            uint256 amountFTM,\\n            uint256 liquidity\\n        );\\n\\n    function removeLiquidity(\\n        address tokenA,\\n        address tokenB,\\n        uint256 liquidity,\\n        uint256 amountAMin,\\n        uint256 amountBMin,\\n        address to,\\n        uint256 deadline\\n    ) external returns (uint256 amountA, uint256 amountB);\\n\\n    function removeLiquidityFTM(\\n        address token,\\n        uint256 liquidity,\\n        uint256 amountTokenMin,\\n        uint256 amountFTMMin,\\n        address to,\\n        uint256 deadline\\n    ) external returns (uint256 amountToken, uint256 amountFTM);\\n\\n    function removeLiquidityWithPermit(\\n        address tokenA,\\n        address tokenB,\\n        uint256 liquidity,\\n        uint256 amountAMin,\\n        uint256 amountBMin,\\n        address to,\\n        uint256 deadline,\\n        bool approveMax,\\n        uint8 v,\\n        bytes32 r,\\n        bytes32 s\\n    ) external returns (uint256 amountA, uint256 amountB);\\n\\n    function removeLiquidityFTMWithPermit(\\n        address token,\\n        uint256 liquidity,\\n        uint256 amountTokenMin,\\n        uint256 amountFTMMin,\\n        address to,\\n        uint256 deadline,\\n        bool approveMax,\\n        uint8 v,\\n        bytes32 r,\\n        bytes32 s\\n    ) external returns (uint256 amountToken, uint256 amountFTM);\\n\\n    function swapExactTokensForTokens(\\n        uint256 amountIn,\\n        uint256 amountOutMin,\\n        address[] calldata path,\\n        address to,\\n        uint256 deadline\\n    ) external returns (uint256[] memory amounts);\\n\\n    function swapTokensForExactTokens(\\n        uint256 amountOut,\\n        uint256 amountInMax,\\n        address[] calldata path,\\n        address to,\\n        uint256 deadline\\n    ) external returns (uint256[] memory amounts);\\n\\n    function swapExactFTMForTokens(\\n        uint256 amountOutMin,\\n        address[] calldata path,\\n        address to,\\n        uint256 deadline\\n    ) external payable returns (uint256[] memory amounts);\\n\\n    function swapTokensForExactFTM(\\n        uint256 amountOut,\\n        uint256 amountInMax,\\n        address[] calldata path,\\n        address to,\\n        uint256 deadline\\n    ) external returns (uint256[] memory amounts);\\n\\n    function swapExactTokensForFTM(\\n        uint256 amountIn,\\n        uint256 amountOutMin,\\n        address[] calldata path,\\n        address to,\\n        uint256 deadline\\n    ) external returns (uint256[] memory amounts);\\n\\n    function swapFTMForExactTokens(\\n        uint256 amountOut,\\n        address[] calldata path,\\n        address to,\\n        uint256 deadline\\n    ) external payable returns (uint256[] memory amounts);\\n\\n    function quote(\\n        uint256 amountA,\\n        uint256 reserveA,\\n        uint256 reserveB\\n    ) external pure returns (uint256 amountB);\\n\\n    function getAmountOut(\\n        uint256 amountIn,\\n        uint256 reserveIn,\\n        uint256 reserveOut\\n    ) external pure returns (uint256 amountOut);\\n\\n    function getAmountIn(\\n        uint256 amountOut,\\n        uint256 reserveIn,\\n        uint256 reserveOut\\n    ) external pure returns (uint256 amountIn);\\n\\n    function getAmountsOut(uint256 amountIn, address[] calldata path)\\n        external\\n        view\\n        returns (uint256[] memory amounts);\\n\\n    function getAmountsIn(uint256 amountOut, address[] calldata path)\\n        external\\n        view\\n        returns (uint256[] memory amounts);\\n}\\n\\n// Part: IUniswapV2Pair\\n\\ninterface IUniswapV2Pair {\\n    event Approval(\\n        address indexed owner,\\n        address indexed spender,\\n        uint256 value\\n    );\\n    event Transfer(address indexed from, address indexed to, uint256 value);\\n\\n    function name() external pure returns (string memory);\\n\\n    function symbol() external pure returns (string memory);\\n\\n    function decimals() external pure returns (uint8);\\n\\n    function totalSupply() external view returns (uint256);\\n\\n    function balanceOf(address owner) external view returns (uint256);\\n\\n    function allowance(address owner, address spender)\\n        external\\n        view\\n        returns (uint256);\\n\\n    function approve(address spender, uint256 value) external returns (bool);\\n\\n    function transfer(address to, uint256 value) external returns (bool);\\n\\n    function transferFrom(\\n        address from,\\n        address to,\\n        uint256 value\\n    ) external returns (bool);\\n\\n    function DOMAIN_SEPARATOR() external view returns (bytes32);\\n\\n    function PERMIT_TYPEHASH() external pure returns (bytes32);\\n\\n    function nonces(address owner) external view returns (uint256);\\n\\n    function permit(\\n        address owner,\\n        address spender,\\n        uint256 value,\\n        uint256 deadline,\\n        uint8 v,\\n        bytes32 r,\\n        bytes32 s\\n    ) external;\\n\\n    event Mint(address indexed sender, uint256 amount0, uint256 amount1);\\n    event Burn(\\n        address indexed sender,\\n        uint256 amount0,\\n        uint256 amount1,\\n        address indexed to\\n    );\\n    event Swap(\\n        address indexed sender,\\n        uint256 amount0In,\\n        uint256 amount1In,\\n        uint256 amount0Out,\\n        uint256 amount1Out,\\n        address indexed to\\n    );\\n    event Sync(uint112 reserve0, uint112 reserve1);\\n\\n    function MINIMUM_LIQUIDITY() external pure returns (uint256);\\n\\n    function factory() external view returns (address);\\n\\n    function token0() external view returns (address);\\n\\n    function token1() external view returns (address);\\n\\n    function getReserves()\\n        external\\n        view\\n        returns (\\n            uint112 reserve0,\\n            uint112 reserve1,\\n            uint32 blockTimestampLast\\n        );\\n\\n    function price0CumulativeLast() external view returns (uint256);\\n\\n    function price1CumulativeLast() external view returns (uint256);\\n\\n    function kLast() external view returns (uint256);\\n\\n    function mint(address to) external returns (uint256 liquidity);\\n\\n    function burn(address to)\\n        external\\n        returns (uint256 amount0, uint256 amount1);\\n\\n    function swap(\\n        uint256 amount0Out,\\n        uint256 amount1Out,\\n        address to,\\n        bytes calldata data\\n    ) external;\\n\\n    function skim(address to) external;\\n\\n    function sync() external;\\n\\n    function initialize(address, address) external;\\n}\\n\\n// Part: IUniswapV2Router01\\n\\ninterface IUniswapV2Router01 {\\n    function factory() external pure returns (address);\\n\\n    function WETH() external pure returns (address);\\n\\n    function addLiquidity(\\n        address tokenA,\\n        address tokenB,\\n        uint256 amountADesired,\\n        uint256 amountBDesired,\\n        uint256 amountAMin,\\n        uint256 amountBMin,\\n        address to,\\n        uint256 deadline\\n    )\\n        external\\n        returns (\\n            uint256 amountA,\\n            uint256 amountB,\\n            uint256 liquidity\\n        );\\n\\n    function addLiquidityETH(\\n        address token,\\n        uint256 amountTokenDesired,\\n        uint256 amountTokenMin,\\n        uint256 amountETHMin,\\n        address to,\\n        uint256 deadline\\n    )\\n        external\\n        payable\\n        returns (\\n            uint256 amountToken,\\n            uint256 amountETH,\\n            uint256 liquidity\\n        );\\n\\n    function removeLiquidity(\\n        address tokenA,\\n        address tokenB,\\n        uint256 liquidity,\\n        uint256 amountAMin,\\n        uint256 amountBMin,\\n        address to,\\n        uint256 deadline\\n    ) external returns (uint256 amountA, uint256 amountB);\\n\\n    function removeLiquidityETH(\\n        address token,\\n        uint256 liquidity,\\n        uint256 amountTokenMin,\\n        uint256 amountETHMin,\\n        address to,\\n        uint256 deadline\\n    ) external returns (uint256 amountToken, uint256 amountETH);\\n\\n    function removeLiquidityWithPermit(\\n        address tokenA,\\n        address tokenB,\\n        uint256 liquidity,\\n        uint256 amountAMin,\\n        uint256 amountBMin,\\n        address to,\\n        uint256 deadline,\\n        bool approveMax,\\n        uint8 v,\\n        bytes32 r,\\n        bytes32 s\\n    ) external returns (uint256 amountA, uint256 amountB);\\n\\n    function removeLiquidityETHWithPermit(\\n        address token,\\n        uint256 liquidity,\\n        uint256 amountTokenMin,\\n        uint256 amountETHMin,\\n        address to,\\n        uint256 deadline,\\n        bool approveMax,\\n        uint8 v,\\n        bytes32 r,\\n        bytes32 s\\n    ) external returns (uint256 amountToken, uint256 amountETH);\\n\\n    function swapExactTokensForTokens(\\n        uint256 amountIn,\\n        uint256 amountOutMin,\\n        address[] calldata path,\\n        address to,\\n        uint256 deadline\\n    ) external returns (uint256[] memory amounts);\\n\\n    function swapTokensForExactTokens(\\n        uint256 amountOut,\\n        uint256 amountInMax,\\n        address[] calldata path,\\n        address to,\\n        uint256 deadline\\n    ) external returns (uint256[] memory amounts);\\n\\n    function swapExactTokensForTokensSupportingFeeOnTransferTokens(\\n        uint256 amountIn,\\n        uint256 amountOutMin,\\n        address[] calldata path,\\n        address to,\\n        uint256 deadline\\n    ) external;\\n\\n    function swapExactTokensForETHSupportingFeeOnTransferTokens(\\n        uint256 amountIn,\\n        uint256 amountOutMin,\\n        address[] calldata path,\\n        address to,\\n        uint256 deadline\\n    ) external;\\n\\n    function swapExactETHForTokens(\\n        uint256 amountOutMin,\\n        address[] calldata path,\\n        address to,\\n        uint256 deadline\\n    ) external payable returns (uint256[] memory amounts);\\n\\n    function swapTokensForExactETH(\\n        uint256 amountOut,\\n        uint256 amountInMax,\\n        address[] calldata path,\\n        address to,\\n        uint256 deadline\\n    ) external returns (uint256[] memory amounts);\\n\\n    function swapExactTokensForETH(\\n        uint256 amountIn,\\n        uint256 amountOutMin,\\n        address[] calldata path,\\n        address to,\\n        uint256 deadline\\n    ) external returns (uint256[] memory amounts);\\n\\n    function swapETHForExactTokens(\\n        uint256 amountOut,\\n        address[] calldata path,\\n        address to,\\n        uint256 deadline\\n    ) external payable returns (uint256[] memory amounts);\\n\\n    function quote(\\n        uint256 amountA,\\n        uint256 reserveA,\\n        uint256 reserveB\\n    ) external pure returns (uint256 amountB);\\n\\n    function getAmountOut(\\n        uint256 amountIn,\\n        uint256 reserveIn,\\n        uint256 reserveOut\\n    ) external pure returns (uint256 amountOut);\\n\\n    function getAmountIn(\\n        uint256 amountOut,\\n        uint256 reserveIn,\\n        uint256 reserveOut\\n    ) external pure returns (uint256 amountIn);\\n\\n    function getAmountsOut(uint256 amountIn, address[] calldata path)\\n        external\\n        view\\n        returns (uint256[] memory amounts);\\n\\n    function getAmountsIn(uint256 amountOut, address[] calldata path)\\n        external\\n        view\\n        returns (uint256[] memory amounts);\\n}\\n\\n// Part: OpenZeppelin/openzeppelin-contracts@4.1.0/IERC20\\n\\n/**\\n * @dev Interface of the ERC20 standard as defined in the EIP.\\n */\\ninterface IERC20 {\\n    /**\\n     * @dev Returns the amount of tokens in existence.\\n     */\\n    function totalSupply() external view returns (uint256);\\n\\n    /**\\n     * @dev Returns the amount of tokens owned by `account`.\\n     */\\n    function balanceOf(address account) external view returns (uint256);\\n\\n    /**\\n     * @dev Moves `amount` tokens from the caller's account to `recipient`.\\n     *\\n     * Returns a boolean value indicating whether the operation succeeded.\\n     *\\n     * Emits a {Transfer} event.\\n     */\\n    function transfer(address recipient, uint256 amount)\\n        external\\n        returns (bool);\\n\\n    /**\\n     * @dev Returns the remaining number of tokens that `spender` will be\\n     * allowed to spend on behalf of `owner` through {transferFrom}. This is\\n     * zero by default.\\n     *\\n     * This value changes when {approve} or {transferFrom} are called.\\n     */\\n    function allowance(address owner, address spender)\\n        external\\n        view\\n        returns (uint256);\\n\\n    /**\\n     * @dev Sets `amount` as the allowance of `spender` over the caller's tokens.\\n     *\\n     * Returns a boolean value indicating whether the operation succeeded.\\n     *\\n     * IMPORTANT: Beware that changing an allowance with this method brings the risk\\n     * that someone may use both the old and the new allowance by unfortunate\\n     * transaction ordering. One possible solution to mitigate this race\\n     * condition is to first reduce the spender's allowance to 0 and set the\\n     * desired value afterwards:\\n     * https://github.com/ethereum/EIPs/issues/20#issuecomment-263524729\\n     *\\n     * Emits an {Approval} event.\\n     */\\n    function approve(address spender, uint256 amount) external returns (bool);\\n\\n    /**\\n     * @dev Moves `amount` tokens from `sender` to `recipient` using the\\n     * allowance mechanism. `amount` is then deducted from the caller's\\n     * allowance.\\n     *\\n     * Returns a boolean value indicating whether the operation succeeded.\\n     *\\n     * Emits a {Transfer} event.\\n     */\\n    function transferFrom(\\n        address sender,\\n        address recipient,\\n        uint256 amount\\n    ) external returns (bool);\\n\\n    /**\\n     * @dev Emitted when `value` tokens are moved from one account (`from`) to\\n     * another (`to`).\\n     *\\n     * Note that `value` may be zero.\\n     */\\n    event Transfer(address indexed from, address indexed to, uint256 value);\\n\\n    /**\\n     * @dev Emitted when the allowance of a `spender` for an `owner` is set by\\n     * a call to {approve}. `value` is the new allowance.\\n     */\\n    event Approval(\\n        address indexed owner,\\n        address indexed spender,\\n        uint256 value\\n    );\\n}\\n\\n// Part: IVault\\n\\ninterface IVault is IERC20 {\\n    function deposit(uint256 amount) external;\\n\\n    function withdraw(uint256 shares) external;\\n\\n    function want() external pure returns (address);\\n}\\n\\n// Part: OpenZeppelin/openzeppelin-contracts@4.1.0/Address\\n\\n/**\\n * @dev Collection of functions related to the address type\\n */\\nlibrary Address {\\n    /**\\n     * @dev Returns true if `account` is a contract.\\n     *\\n     * [IMPORTANT]\\n     * ====\\n     * It is unsafe to assume that an address for which this function returns\\n     * false is an externally-owned account (EOA) and not a contract.\\n     *\\n     * Among others, `isContract` will return false for the following\\n     * types of addresses:\\n     *\\n     *  - an externally-owned account\\n     *  - a contract in construction\\n     *  - an address where a contract will be created\\n     *  - an address where a contract lived, but was destroyed\\n     * ====\\n     */\\n    function isContract(address account) internal view returns (bool) {\\n        // This method relies on extcodesize, which returns 0 for contracts in\\n        // construction, since the code is only stored at the end of the\\n        // constructor execution.\\n\\n        uint256 size;\\n        // solhint-disable-next-line no-inline-assembly\\n        assembly {\\n            size := extcodesize(account)\\n        }\\n        return size > 0;\\n    }\\n\\n    /**\\n     * @dev Replacement for Solidity's `transfer`: sends `amount` wei to\\n     * `recipient`, forwarding all available gas and reverting on errors.\\n     *\\n     * https://eips.ethereum.org/EIPS/eip-1884[EIP1884] increases the gas cost\\n     * of certain opcodes, possibly making contracts go over the 2300 gas limit\\n     * imposed by `transfer`, making them unable to receive funds via\\n     * `transfer`. {sendValue} removes this limitation.\\n     *\\n     * https://diligence.consensys.net/posts/2019/09/stop-using-soliditys-transfer-now/[Learn more].\\n     *\\n     * IMPORTANT: because control is transferred to `recipient`, care must be\\n     * taken to not create reentrancy vulnerabilities. Consider using\\n     * {ReentrancyGuard} or the\\n     * https://solidity.readthedocs.io/en/v0.5.11/security-considerations.html#use-the-checks-effects-interactions-pattern[checks-effects-interactions pattern].\\n     */\\n    function sendValue(address payable recipient, uint256 amount) internal {\\n        require(\\n            address(this).balance >= amount,\\n            \\\"Address: insufficient balance\\\"\\n        );\\n\\n        // solhint-disable-next-line avoid-low-level-calls, avoid-call-value\\n        (bool success, ) = recipient.call{value: amount}(\\\"\\\");\\n        require(\\n            success,\\n            \\\"Address: unable to send value, recipient may have reverted\\\"\\n        );\\n    }\\n\\n    /**\\n     * @dev Performs a Solidity function call using a low level `call`. A\\n     * plain`call` is an unsafe replacement for a function call: use this\\n     * function instead.\\n     *\\n     * If `target` reverts with a revert reason, it is bubbled up by this\\n     * function (like regular Solidity function calls).\\n     *\\n     * Returns the raw returned data. To convert to the expected return value,\\n     * use https://solidity.readthedocs.io/en/latest/units-and-global-variables.html?highlight=abi.decode#abi-encoding-and-decoding-functions[`abi.decode`].\\n     *\\n     * Requirements:\\n     *\\n     * - `target` must be a contract.\\n     * - calling `target` with `data` must not revert.\\n     *\\n     * _Available since v3.1._\\n     */\\n    function functionCall(address target, bytes memory data)\\n        internal\\n        returns (bytes memory)\\n    {\\n        return functionCall(target, data, \\\"Address: low-level call failed\\\");\\n    }\\n\\n    /**\\n     * @dev Same as {xref-Address-functionCall-address-bytes-}[`functionCall`], but with\\n     * `errorMessage` as a fallback revert reason when `target` reverts.\\n     *\\n     * _Available since v3.1._\\n     */\\n    function functionCall(\\n        address target,\\n        bytes memory data,\\n        string memory errorMessage\\n    ) internal returns (bytes memory) {\\n        return functionCallWithValue(target, data, 0, errorMessage);\\n    }\\n\\n    /**\\n     * @dev Same as {xref-Address-functionCall-address-bytes-}[`functionCall`],\\n     * but also transferring `value` wei to `target`.\\n     *\\n     * Requirements:\\n     *\\n     * - the calling contract must have an ETH balance of at least `value`.\\n     * - the called Solidity function must be `payable`.\\n     *\\n     * _Available since v3.1._\\n     */\\n    function functionCallWithValue(\\n        address target,\\n        bytes memory data,\\n        uint256 value\\n    ) internal returns (bytes memory) {\\n        return\\n            functionCallWithValue(\\n                target,\\n                data,\\n                value,\\n                \\\"Address: low-level call with value failed\\\"\\n            );\\n    }\\n\\n    /**\\n     * @dev Same as {xref-Address-functionCallWithValue-address-bytes-uint256-}[`functionCallWithValue`], but\\n     * with `errorMessage` as a fallback revert reason when `target` reverts.\\n     *\\n     * _Available since v3.1._\\n     */\\n    function functionCallWithValue(\\n        address target,\\n        bytes memory data,\\n        uint256 value,\\n        string memory errorMessage\\n    ) internal returns (bytes memory) {\\n        require(\\n            address(this).balance >= value,\\n            \\\"Address: insufficient balance for call\\\"\\n        );\\n        require(isContract(target), \\\"Address: call to non-contract\\\");\\n\\n        // solhint-disable-next-line avoid-low-level-calls\\n        (bool success, bytes memory returndata) = target.call{value: value}(\\n            data\\n        );\\n        return _verifyCallResult(success, returndata, errorMessage);\\n    }\\n\\n    /**\\n     * @dev Same as {xref-Address-functionCall-address-bytes-}[`functionCall`],\\n     * but performing a static call.\\n     *\\n     * _Available since v3.3._\\n     */\\n    function functionStaticCall(address target, bytes memory data)\\n        internal\\n        view\\n        returns (bytes memory)\\n    {\\n        return\\n            functionStaticCall(\\n                target,\\n                data,\\n                \\\"Address: low-level static call failed\\\"\\n            );\\n    }\\n\\n    /**\\n     * @dev Same as {xref-Address-functionCall-address-bytes-string-}[`functionCall`],\\n     * but performing a static call.\\n     *\\n     * _Available since v3.3._\\n     */\\n    function functionStaticCall(\\n        address target,\\n        bytes memory data,\\n        string memory errorMessage\\n    ) internal view returns (bytes memory) {\\n        require(isContract(target), \\\"Address: static call to non-contract\\\");\\n\\n        // solhint-disable-next-line avoid-low-level-calls\\n        (bool success, bytes memory returndata) = target.staticcall(data);\\n        return _verifyCallResult(success, returndata, errorMessage);\\n    }\\n\\n    /**\\n     * @dev Same as {xref-Address-functionCall-address-bytes-}[`functionCall`],\\n     * but performing a delegate call.\\n     *\\n     * _Available since v3.4._\\n     */\\n    function functionDelegateCall(address target, bytes memory data)\\n        internal\\n        returns (bytes memory)\\n    {\\n        return\\n            functionDelegateCall(\\n                target,\\n                data,\\n                \\\"Address: low-level delegate call failed\\\"\\n            );\\n    }\\n\\n    /**\\n     * @dev Same as {xref-Address-functionCall-address-bytes-string-}[`functionCall`],\\n     * but performing a delegate call.\\n     *\\n     * _Available since v3.4._\\n     */\\n    function functionDelegateCall(\\n        address target,\\n        bytes memory data,\\n        string memory errorMessage\\n    ) internal returns (bytes memory) {\\n        require(isContract(target), \\\"Address: delegate call to non-contract\\\");\\n\\n        // solhint-disable-next-line avoid-low-level-calls\\n        (bool success, bytes memory returndata) = target.delegatecall(data);\\n        return _verifyCallResult(success, returndata, errorMessage);\\n    }\\n\\n    function _verifyCallResult(\\n        bool success,\\n        bytes memory returndata,\\n        string memory errorMessage\\n    ) private pure returns (bytes memory) {\\n        if (success) {\\n            return returndata;\\n        } else {\\n            // Look for revert reason and bubble it up if present\\n            if (returndata.length > 0) {\\n                // The easiest way to bubble the revert reason is using memory via assembly\\n\\n                // solhint-disable-next-line no-inline-assembly\\n                assembly {\\n                    let returndata_size := mload(returndata)\\n                    revert(add(32, returndata), returndata_size)\\n                }\\n            } else {\\n                revert(errorMessage);\\n            }\\n        }\\n    }\\n}\\n\\n// Part: OpenZeppelin/openzeppelin-contracts@4.1.0/SafeMath\\n\\n// CAUTION\\n// This version of SafeMath should only be used with Solidity 0.8 or later,\\n// because it relies on the compiler's built in overflow checks.\\n\\n/**\\n * @dev Wrappers over Solidity's arithmetic operations.\\n *\\n * NOTE: `SafeMath` is no longer needed starting with Solidity 0.8. The compiler\\n * now has built in overflow checking.\\n */\\nlibrary SafeMath {\\n    /**\\n     * @dev Returns the addition of two unsigned integers, with an overflow flag.\\n     *\\n     * _Available since v3.4._\\n     */\\n    function tryAdd(uint256 a, uint256 b)\\n        internal\\n        pure\\n        returns (bool, uint256)\\n    {\\n        unchecked {\\n            uint256 c = a + b;\\n            if (c < a) return (false, 0);\\n            return (true, c);\\n        }\\n    }\\n\\n    /**\\n     * @dev Returns the substraction of two unsigned integers, with an overflow flag.\\n     *\\n     * _Available since v3.4._\\n     */\\n    function trySub(uint256 a, uint256 b)\\n        internal\\n        pure\\n        returns (bool, uint256)\\n    {\\n        unchecked {\\n            if (b > a) return (false, 0);\\n            return (true, a - b);\\n        }\\n    }\\n\\n    /**\\n     * @dev Returns the multiplication of two unsigned integers, with an overflow flag.\\n     *\\n     * _Available since v3.4._\\n     */\\n    function tryMul(uint256 a, uint256 b)\\n        internal\\n        pure\\n        returns (bool, uint256)\\n    {\\n        unchecked {\\n            // Gas optimization: this is cheaper than requiring 'a' not being zero, but the\\n            // benefit is lost if 'b' is also tested.\\n            // See: https://github.com/OpenZeppelin/openzeppelin-contracts/pull/522\\n            if (a == 0) return (true, 0);\\n            uint256 c = a * b;\\n            if (c / a != b) return (false, 0);\\n            return (true, c);\\n        }\\n    }\\n\\n    /**\\n     * @dev Returns the division of two unsigned integers, with a division by zero flag.\\n     *\\n     * _Available since v3.4._\\n     */\\n    function tryDiv(uint256 a, uint256 b)\\n        internal\\n        pure\\n        returns (bool, uint256)\\n    {\\n        unchecked {\\n            if (b == 0) return (false, 0);\\n            return (true, a / b);\\n        }\\n    }\\n\\n    /**\\n     * @dev Returns the remainder of dividing two unsigned integers, with a division by zero flag.\\n     *\\n     * _Available since v3.4._\\n     */\\n    function tryMod(uint256 a, uint256 b)\\n        internal\\n        pure\\n        returns (bool, uint256)\\n    {\\n        unchecked {\\n            if (b == 0) return (false, 0);\\n            return (true, a % b);\\n        }\\n    }\\n\\n    /**\\n     * @dev Returns the addition of two unsigned integers, reverting on\\n     * overflow.\\n     *\\n     * Counterpart to Solidity's `+` operator.\\n     *\\n     * Requirements:\\n     *\\n     * - Addition cannot overflow.\\n     */\\n    function add(uint256 a, uint256 b) internal pure returns (uint256) {\\n        return a + b;\\n    }\\n\\n    /**\\n     * @dev Returns the subtraction of two unsigned integers, reverting on\\n     * overflow (when the result is negative).\\n     *\\n     * Counterpart to Solidity's `-` operator.\\n     *\\n     * Requirements:\\n     *\\n     * - Subtraction cannot overflow.\\n     */\\n    function sub(uint256 a, uint256 b) internal pure returns (uint256) {\\n        return a - b;\\n    }\\n\\n    /**\\n     * @dev Returns the multiplication of two unsigned integers, reverting on\\n     * overflow.\\n     *\\n     * Counterpart to Solidity's `*` operator.\\n     *\\n     * Requirements:\\n     *\\n     * - Multiplication cannot overflow.\\n     */\\n    function mul(uint256 a, uint256 b) internal pure returns (uint256) {\\n        return a * b;\\n    }\\n\\n    /**\\n     * @dev Returns the integer division of two unsigned integers, reverting on\\n     * division by zero. The result is rounded towards zero.\\n     *\\n     * Counterpart to Solidity's `/` operator.\\n     *\\n     * Requirements:\\n     *\\n     * - The divisor cannot be zero.\\n     */\\n    function div(uint256 a, uint256 b) internal pure returns (uint256) {\\n        return a / b;\\n    }\\n\\n    /**\\n     * @dev Returns the remainder of dividing two unsigned integers. (unsigned integer modulo),\\n     * reverting when dividing by zero.\\n     *\\n     * Counterpart to Solidity's `%` operator. This function uses a `revert`\\n     * opcode (which leaves remaining gas untouched) while Solidity uses an\\n     * invalid opcode to revert (consuming all remaining gas).\\n     *\\n     * Requirements:\\n     *\\n     * - The divisor cannot be zero.\\n     */\\n    function mod(uint256 a, uint256 b) internal pure returns (uint256) {\\n        return a % b;\\n    }\\n\\n    /**\\n     * @dev Returns the subtraction of two unsigned integers, reverting with custom message on\\n     * overflow (when the result is negative).\\n     *\\n     * CAUTION: This function is deprecated because it requires allocating memory for the error\\n     * message unnecessarily. For custom revert reasons use {trySub}.\\n     *\\n     * Counterpart to Solidity's `-` operator.\\n     *\\n     * Requirements:\\n     *\\n     * - Subtraction cannot overflow.\\n     */\\n    function sub(\\n        uint256 a,\\n        uint256 b,\\n        string memory errorMessage\\n    ) internal pure returns (uint256) {\\n        unchecked {\\n            require(b <= a, errorMessage);\\n            return a - b;\\n        }\\n    }\\n\\n    /**\\n     * @dev Returns the integer division of two unsigned integers, reverting with custom message on\\n     * division by zero. The result is rounded towards zero.\\n     *\\n     * Counterpart to Solidity's `%` operator. This function uses a `revert`\\n     * opcode (which leaves remaining gas untouched) while Solidity uses an\\n     * invalid opcode to revert (consuming all remaining gas).\\n     *\\n     * Counterpart to Solidity's `/` operator. Note: this function uses a\\n     * `revert` opcode (which leaves remaining gas untouched) while Solidity\\n     * uses an invalid opcode to revert (consuming all remaining gas).\\n     *\\n     * Requirements:\\n     *\\n     * - The divisor cannot be zero.\\n     */\\n    function div(\\n        uint256 a,\\n        uint256 b,\\n        string memory errorMessage\\n    ) internal pure returns (uint256) {\\n        unchecked {\\n            require(b > 0, errorMessage);\\n            return a / b;\\n        }\\n    }\\n\\n    /**\\n     * @dev Returns the remainder of dividing two unsigned integers. (unsigned integer modulo),\\n     * reverting with custom message when dividing by zero.\\n     *\\n     * CAUTION: This function is deprecated because it requires allocating memory for the error\\n     * message unnecessarily. For custom revert reasons use {tryMod}.\\n     *\\n     * Counterpart to Solidity's `%` operator. This function uses a `revert`\\n     * opcode (which leaves remaining gas untouched) while Solidity uses an\\n     * invalid opcode to revert (consuming all remaining gas).\\n     *\\n     * Requirements:\\n     *\\n     * - The divisor cannot be zero.\\n     */\\n    function mod(\\n        uint256 a,\\n        uint256 b,\\n        string memory errorMessage\\n    ) internal pure returns (uint256) {\\n        unchecked {\\n            require(b > 0, errorMessage);\\n            return a % b;\\n        }\\n    }\\n}\\n\\n// Part: TransferHelper\\n\\n// helper methods for interacting with ERC20 tokens and sending ETH that do not consistently return true/false\\nlibrary TransferHelper {\\n    function safeApprove(\\n        address token,\\n        address to,\\n        uint256 value\\n    ) internal {\\n        // bytes4(keccak256(bytes('approve(address,uint256)')));\\n        (bool success, bytes memory data) = token.call(\\n            abi.encodeWithSelector(0x095ea7b3, to, value)\\n        );\\n        require(\\n            success && (data.length == 0 || abi.decode(data, (bool))),\\n            \\\"TransferHelper: APPROVE_FAILED\\\"\\n        );\\n    }\\n\\n    function safeTransfer(\\n        address token,\\n        address to,\\n        uint256 value\\n    ) internal {\\n        // bytes4(keccak256(bytes('transfer(address,uint256)')));\\n        (bool success, bytes memory data) = token.call(\\n            abi.encodeWithSelector(0xa9059cbb, to, value)\\n        );\\n        require(\\n            success && (data.length == 0 || abi.decode(data, (bool))),\\n            \\\"TransferHelper: TRANSFER_FAILED\\\"\\n        );\\n    }\\n\\n    function safeTransferFrom(\\n        address token,\\n        address from,\\n        address to,\\n        uint256 value\\n    ) internal {\\n        // bytes4(keccak256(bytes('transferFrom(address,address,uint256)')));\\n        (bool success, bytes memory data) = token.call(\\n            abi.encodeWithSelector(0x23b872dd, from, to, value)\\n        );\\n        require(\\n            success && (data.length == 0 || abi.decode(data, (bool))),\\n            \\\"TransferHelper: TRANSFER_FROM_FAILED\\\"\\n        );\\n    }\\n\\n    function safeTransferETH(address to, uint256 value) internal {\\n        (bool success, ) = to.call{value: value}(new bytes(0));\\n        require(success, \\\"TransferHelper: ETH_TRANSFER_FAILED\\\");\\n    }\\n}\\n\\n// Part: OpenZeppelin/openzeppelin-contracts@4.1.0/SafeERC20\\n\\n/**\\n * @title SafeERC20\\n * @dev Wrappers around ERC20 operations that throw on failure (when the token\\n * contract returns false). Tokens that return no value (and instead revert or\\n * throw on failure) are also supported, non-reverting calls are assumed to be\\n * successful.\\n * To use this library you can add a `using SafeERC20 for IERC20;` statement to your contract,\\n * which allows you to call the safe operations as `token.safeTransfer(...)`, etc.\\n */\\nlibrary SafeERC20 {\\n    using Address for address;\\n\\n    function safeTransfer(\\n        IERC20 token,\\n        address to,\\n        uint256 value\\n    ) internal {\\n        _callOptionalReturn(\\n            token,\\n            abi.encodeWithSelector(token.transfer.selector, to, value)\\n        );\\n    }\\n\\n    function safeTransferFrom(\\n        IERC20 token,\\n        address from,\\n        address to,\\n        uint256 value\\n    ) internal {\\n        _callOptionalReturn(\\n            token,\\n            abi.encodeWithSelector(token.transferFrom.selector, from, to, value)\\n        );\\n    }\\n\\n    /**\\n     * @dev Deprecated. This function has issues similar to the ones found in\\n     * {IERC20-approve}, and its usage is discouraged.\\n     *\\n     * Whenever possible, use {safeIncreaseAllowance} and\\n     * {safeDecreaseAllowance} instead.\\n     */\\n    function safeApprove(\\n        IERC20 token,\\n        address spender,\\n        uint256 value\\n    ) internal {\\n        // safeApprove should only be called when setting an initial allowance,\\n        // or when resetting it to zero. To increase and decrease it, use\\n        // 'safeIncreaseAllowance' and 'safeDecreaseAllowance'\\n        // solhint-disable-next-line max-line-length\\n        require(\\n            (value == 0) || (token.allowance(address(this), spender) == 0),\\n            \\\"SafeERC20: approve from non-zero to non-zero allowance\\\"\\n        );\\n        _callOptionalReturn(\\n            token,\\n            abi.encodeWithSelector(token.approve.selector, spender, value)\\n        );\\n    }\\n\\n    function safeIncreaseAllowance(\\n        IERC20 token,\\n        address spender,\\n        uint256 value\\n    ) internal {\\n        uint256 newAllowance = token.allowance(address(this), spender) + value;\\n        _callOptionalReturn(\\n            token,\\n            abi.encodeWithSelector(\\n                token.approve.selector,\\n                spender,\\n                newAllowance\\n            )\\n        );\\n    }\\n\\n    function safeDecreaseAllowance(\\n        IERC20 token,\\n        address spender,\\n        uint256 value\\n    ) internal {\\n        unchecked {\\n            uint256 oldAllowance = token.allowance(address(this), spender);\\n            require(\\n                oldAllowance >= value,\\n                \\\"SafeERC20: decreased allowance below zero\\\"\\n            );\\n            uint256 newAllowance = oldAllowance - value;\\n            _callOptionalReturn(\\n                token,\\n                abi.encodeWithSelector(\\n                    token.approve.selector,\\n                    spender,\\n                    newAllowance\\n                )\\n            );\\n        }\\n    }\\n\\n    /**\\n     * @dev Imitates a Solidity high-level call (i.e. a regular function call to a contract), relaxing the requirement\\n     * on the return value: the return value is optional (but if data is returned, it must not be false).\\n     * @param token The token targeted by the call.\\n     * @param data The call data (encoded using abi.encode or one of its variants).\\n     */\\n    function _callOptionalReturn(IERC20 token, bytes memory data) private {\\n        // We need to perform a low level call here, to bypass Solidity's return data size checking mechanism, since\\n        // we're implementing it ourselves. We use {Address.functionCall} to perform this call, which verifies that\\n        // the target address contains contract code and also asserts for success in the low-level call.\\n\\n        bytes memory returndata = address(token).functionCall(\\n            data,\\n            \\\"SafeERC20: low-level call failed\\\"\\n        );\\n        if (returndata.length > 0) {\\n            // Return data is optional\\n            // solhint-disable-next-line max-line-length\\n            require(\\n                abi.decode(returndata, (bool)),\\n                \\\"SafeERC20: ERC20 operation did not succeed\\\"\\n            );\\n        }\\n    }\\n}\\n\\n// File: Context.sol\\n\\npragma solidity ^0.8.7;\\n\\n/*\\n * @dev Provides information about the current execution context, including the\\n * sender of the transaction and its data. While these are generally available\\n * via msg.sender and msg.data, they should not be accessed in such a direct\\n * manner, since when dealing with meta-transactions the account sending and\\n * paying for execution may not be the actual sender (as far as an application\\n * is concerned).\\n *\\n * This contract is only required for intermediate, library-like contracts.\\n */\\nabstract contract Context {\\n    function _msgSender() internal view virtual returns (address) {\\n        return msg.sender;\\n    }\\n\\n    function _msgData() internal view virtual returns (bytes calldata) {\\n        this; // silence state mutability warning without generating bytecode - see https://github.com/ethereum/solidity/issues/2691\\n        return msg.data;\\n    }\\n}\\n\\n// File: Ownable.sol\\n\\npragma solidity ^0.8.7;\\n\\n/**\\n * @dev Contract module which provides a basic access control mechanism, where\\n * there is an account (an owner) that can be granted exclusive access to\\n * specific functions.\\n *\\n * By default, the owner account will be the one that deploys the contract. This\\n * can later be changed with {transferOwnership}.\\n *\\n * This module is used through inheritance. It will make available the modifier\\n * `onlyOwner`, which can be applied to your functions to restrict their use to\\n * the owner.\\n */\\nabstract contract Ownable is Context {\\n    address private _owner;\\n\\n    event OwnershipTransferred(\\n        address indexed previousOwner,\\n        address indexed newOwner\\n    );\\n\\n    /**\\n     * @dev Initializes the contract setting the deployer as the initial owner.\\n     */\\n    constructor() {\\n        address msgSender = _msgSender();\\n        _owner = msgSender;\\n        emit OwnershipTransferred(address(0), msgSender);\\n    }\\n\\n    /**\\n     * @dev Returns the address of the current owner.\\n     */\\n    function owner() public view virtual returns (address) {\\n        return _owner;\\n    }\\n\\n    /**\\n     * @dev Throws if called by any account other than the owner.\\n     */\\n    modifier onlyOwner() {\\n        require(owner() == _msgSender(), \\\"Ownable: caller is not the owner\\\");\\n        _;\\n    }\\n\\n    /**\\n     * @dev Leaves the contract without owner. It will not be possible to call\\n     * `onlyOwner` functions anymore. Can only be called by the current owner.\\n     *\\n     * NOTE: Renouncing ownership will leave the contract without an owner,\\n     * thereby removing any functionality that is only available to the owner.\\n     */\\n    function renounceOwnership() public virtual onlyOwner {\\n        emit OwnershipTransferred(_owner, address(0));\\n        _owner = address(0);\\n    }\\n\\n    /**\\n     * @dev Transfers ownership of the contract to a new account (`newOwner`).\\n     * Can only be called by the current owner.\\n     */\\n    function transferOwnership(address newOwner) public virtual onlyOwner {\\n        require(\\n            newOwner != address(0),\\n            \\\"Ownable: new owner is the zero address\\\"\\n        );\\n        emit OwnershipTransferred(_owner, newOwner);\\n        _owner = newOwner;\\n    }\\n}\\n\\n// File: IZap.sol\\n\\ninterface IZap {\\n    function estimateZapInToken(\\n        address _from,\\n        address _to,\\n        address _router,\\n        uint256 _amt\\n    ) external view returns (uint256, uint256);\\n\\n    function swapToken(\\n        address _from,\\n        uint256 amount,\\n        address _to,\\n        address routerAddr,\\n        address _recipient\\n    ) external;\\n\\n    function swapToNative(\\n        address _from,\\n        uint256 amount,\\n        address routerAddr,\\n        address _recipient\\n    ) external;\\n\\n    function zapIn(\\n        address _to,\\n        address routerAddr,\\n        address _recipient\\n    ) external payable;\\n\\n    function zapInToken(\\n        address _from,\\n        uint256 amount,\\n        address _to,\\n        address routerAddr,\\n        address _recipient\\n    ) external;\\n\\n    function zapAcross(\\n        address _from,\\n        uint256 amount,\\n        address _toRouter,\\n        address _recipient\\n    ) external;\\n\\n    function zapOut(\\n        address _from,\\n        uint256 amount,\\n        address routerAddr,\\n        address _recipient\\n    ) external;\\n\\n    function zapOutToken(\\n        address _from,\\n        uint256 amount,\\n        address _to,\\n        address routerAddr,\\n        address _recipient\\n    ) external;\\n}\\n\\n// File: Zap.sol\\n\\ncontract Zap is Ownable, IZap {\\n    using SafeMath for uint256;\\n    using SafeERC20 for IERC20;\\n\\n    /* ========== STATE VARIABLES ========== */\\n\\n    address private WNATIVE;\\n    mapping(address => mapping(address => address))\\n        private tokenBridgeForRouter;\\n    mapping(address => bool) public isFeeOnTransfer;\\n\\n    mapping(address => bool) public useNativeRouter;\\n\\n    constructor(address _WNATIVE) Ownable() {\\n        WNATIVE = _WNATIVE;\\n    }\\n\\n    /* ========== External Functions ========== */\\n\\n    receive() external payable {}\\n\\n    function zapInToken(\\n        address _from,\\n        uint256 amount,\\n        address _to,\\n        address routerAddr,\\n        address _recipient\\n    ) external override {\\n        _approveTokenIfNeeded(_from, routerAddr);\\n\\n        if (isFeeOnTransfer[_from]) {\\n            IERC20(_from).transferFrom(msg.sender, address(this), amount);\\n            _swapTokenToLP(\\n                _from,\\n                IERC20(_from).balanceOf(address(this)),\\n                _to,\\n                _recipient,\\n                routerAddr\\n            );\\n            return;\\n        } else {\\n            // From an ERC20 to an LP token, through specified router, going through base asset if necessary\\n            IERC20(_from).safeTransferFrom(msg.sender, address(this), amount);\\n            // we'll need this approval to add liquidity\\n            _approveTokenIfNeeded(_from, routerAddr);\\n            _swapTokenToLP(_from, amount, _to, _recipient, routerAddr);\\n            return;\\n        }\\n    }\\n\\n    function estimateZapInToken(\\n        address _from,\\n        address _to,\\n        address _router,\\n        uint256 _amt\\n    ) public view override returns (uint256, uint256) {\\n        // get pairs for desired lp\\n        if (\\n            _from == IUniswapV2Pair(_to).token0() ||\\n            _from == IUniswapV2Pair(_to).token1()\\n        ) {\\n            // check if we already have one of the assets\\n            // if so, we're going to sell half of _from for the other token we need\\n            // figure out which token we need, and approve\\n            address other = _from == IUniswapV2Pair(_to).token0()\\n                ? IUniswapV2Pair(_to).token1()\\n                : IUniswapV2Pair(_to).token0();\\n            // calculate amount of _from to sell\\n            uint256 sellAmount = _amt.div(2);\\n            // execute swap\\n            uint256 otherAmount = _estimateSwap(\\n                _from,\\n                sellAmount,\\n                other,\\n                _router\\n            );\\n            if (_from == IUniswapV2Pair(_to).token0()) {\\n                return (sellAmount, otherAmount);\\n            } else {\\n                return (otherAmount, sellAmount);\\n            }\\n        } else {\\n            // go through native token for highest liquidity\\n            uint256 nativeAmount = _from == WNATIVE\\n                ? _amt\\n                : _estimateSwap(_from, _amt, WNATIVE, _router);\\n            if (WNATIVE == IUniswapV2Pair(_to).token0()) {\\n                return (\\n                    nativeAmount.div(2),\\n                    _estimateSwap(\\n                        WNATIVE,\\n                        nativeAmount.div(2),\\n                        IUniswapV2Pair(_to).token1(),\\n                        _router\\n                    )\\n                );\\n            }\\n            if (WNATIVE == IUniswapV2Pair(_to).token1()) {\\n                return (\\n                    _estimateSwap(\\n                        WNATIVE,\\n                        nativeAmount.div(2),\\n                        IUniswapV2Pair(_to).token0(),\\n                        _router\\n                    ),\\n                    nativeAmount.div(2)\\n                );\\n            }\\n            return (\\n                _estimateSwap(\\n                    WNATIVE,\\n                    nativeAmount.div(2),\\n                    IUniswapV2Pair(_to).token0(),\\n                    _router\\n                ),\\n                _estimateSwap(\\n                    WNATIVE,\\n                    nativeAmount.div(2),\\n                    IUniswapV2Pair(_to).token1(),\\n                    _router\\n                )\\n            );\\n        }\\n    }\\n\\n    function zapIn(\\n        address _to,\\n        address routerAddr,\\n        address _recipient\\n    ) external payable override {\\n        // from Native to an LP token through the specified router\\n        _swapNativeToLP(_to, msg.value, _recipient, routerAddr);\\n        if (address(this).balance != 0) {\\n            TransferHelper.safeTransferETH(msg.sender, address(this).balance);\\n        }\\n    }\\n\\n    function zapAcross(\\n        address _from,\\n        uint256 amount,\\n        address _toRouter,\\n        address _recipient\\n    ) external override {\\n        IERC20(_from).safeTransferFrom(msg.sender, address(this), amount);\\n\\n        IUniswapV2Pair pair = IUniswapV2Pair(_from);\\n        _approveTokenIfNeeded(pair.token0(), _toRouter);\\n        _approveTokenIfNeeded(pair.token1(), _toRouter);\\n\\n        IERC20(_from).safeTransfer(_from, amount);\\n        uint256 amt0;\\n        uint256 amt1;\\n        (amt0, amt1) = pair.burn(address(this));\\n        IUniswapV2Router01(_toRouter).addLiquidity(\\n            pair.token0(),\\n            pair.token1(),\\n            amt0,\\n            amt1,\\n            0,\\n            0,\\n            _recipient,\\n            block.timestamp\\n        );\\n    }\\n\\n    function zapOut(\\n        address _from,\\n        uint256 amount,\\n        address routerAddr,\\n        address _recipient\\n    ) external override {\\n        // from an LP token to Native through specified router\\n        // take the LP token\\n        IERC20(_from).safeTransferFrom(msg.sender, address(this), amount);\\n        _approveTokenIfNeeded(_from, routerAddr);\\n\\n        // get pairs for LP\\n        address token0 = IUniswapV2Pair(_from).token0();\\n        address token1 = IUniswapV2Pair(_from).token1();\\n        _approveTokenIfNeeded(token0, routerAddr);\\n        _approveTokenIfNeeded(token1, routerAddr);\\n        // check if either is already native token\\n        if (token0 == WNATIVE || token1 == WNATIVE) {\\n            // if so, we only need to swap one, figure out which and how much\\n            address token = token0 != WNATIVE ? token0 : token1;\\n            uint256 amtToken;\\n            uint256 amtETH;\\n            (amtToken, amtETH) = IUniswapV2Router01(routerAddr)\\n                .removeLiquidityETH(\\n                    token,\\n                    amount,\\n                    0,\\n                    0,\\n                    address(this),\\n                    block.timestamp\\n                );\\n            // swap with msg.sender as recipient, so they already get the Native\\n            _swapTokenForNative(token, amtToken, _recipient, routerAddr);\\n            // send other half of Native\\n            TransferHelper.safeTransferETH(_recipient, amtETH);\\n        } else {\\n            // convert both for Native with msg.sender as recipient\\n            uint256 amt0;\\n            uint256 amt1;\\n            (amt0, amt1) = IUniswapV2Router01(routerAddr).removeLiquidity(\\n                token0,\\n                token1,\\n                amount,\\n                0,\\n                0,\\n                address(this),\\n                block.timestamp\\n            );\\n            _swapTokenForNative(token0, amt0, _recipient, routerAddr);\\n            _swapTokenForNative(token1, amt1, _recipient, routerAddr);\\n        }\\n    }\\n\\n    function zapOutToken(\\n        address _from,\\n        uint256 amount,\\n        address _to,\\n        address routerAddr,\\n        address _recipient\\n    ) external override {\\n        // from an LP token to an ERC20 through specified router\\n        IERC20(_from).safeTransferFrom(msg.sender, address(this), amount);\\n        _approveTokenIfNeeded(_from, routerAddr);\\n\\n        address token0 = IUniswapV2Pair(_from).token0();\\n        address token1 = IUniswapV2Pair(_from).token1();\\n        _approveTokenIfNeeded(token0, routerAddr);\\n        _approveTokenIfNeeded(token1, routerAddr);\\n        uint256 amt0;\\n        uint256 amt1;\\n        (amt0, amt1) = IUniswapV2Router01(routerAddr).removeLiquidity(\\n            token0,\\n            token1,\\n            amount,\\n            0,\\n            0,\\n            address(this),\\n            block.timestamp\\n        );\\n        if (token0 != _to) {\\n            amt0 = _swap(token0, amt0, _to, address(this), routerAddr);\\n        }\\n        if (token1 != _to) {\\n            amt1 = _swap(token1, amt1, _to, address(this), routerAddr);\\n        }\\n        IERC20(_to).safeTransfer(_recipient, amt0.add(amt1));\\n    }\\n\\n    function swapToken(\\n        address _from,\\n        uint256 amount,\\n        address _to,\\n        address routerAddr,\\n        address _recipient\\n    ) external override {\\n        IERC20(_from).safeTransferFrom(msg.sender, address(this), amount);\\n        _approveTokenIfNeeded(_from, routerAddr);\\n        _swap(_from, amount, _to, _recipient, routerAddr);\\n    }\\n\\n    function swapToNative(\\n        address _from,\\n        uint256 amount,\\n        address routerAddr,\\n        address _recipient\\n    ) external override {\\n        IERC20(_from).safeTransferFrom(msg.sender, address(this), amount);\\n        _approveTokenIfNeeded(_from, routerAddr);\\n        _swapTokenForNative(_from, amount, _recipient, routerAddr);\\n    }\\n\\n    /* ========== Private Functions ========== */\\n\\n    function _approveTokenIfNeeded(address token, address router) private {\\n        if (IERC20(token).allowance(address(this), router) == 0) {\\n            IERC20(token).safeApprove(router, type(uint256).max);\\n        }\\n    }\\n\\n    function _swapTokenToLP(\\n        address _from,\\n        uint256 amount,\\n        address _to,\\n        address recipient,\\n        address routerAddr\\n    ) private returns (uint256) {\\n        // get pairs for desired lp\\n        if (\\n            _from == IUniswapV2Pair(_to).token0() ||\\n            _from == IUniswapV2Pair(_to).token1()\\n        ) {\\n            // check if we already have one of the assets\\n            // if so, we're going to sell half of _from for the other token we need\\n            // figure out which token we need, and approve\\n            address other = _from == IUniswapV2Pair(_to).token0()\\n                ? IUniswapV2Pair(_to).token1()\\n                : IUniswapV2Pair(_to).token0();\\n            _approveTokenIfNeeded(other, routerAddr);\\n            // calculate amount of _from to sell\\n            uint256 sellAmount = amount.div(2);\\n            // execute swap\\n            uint256 otherAmount = _swap(\\n                _from,\\n                sellAmount,\\n                other,\\n                address(this),\\n                routerAddr\\n            );\\n            uint256 liquidity;\\n            (, , liquidity) = IUniswapV2Router01(routerAddr).addLiquidity(\\n                _from,\\n                other,\\n                amount.sub(sellAmount),\\n                otherAmount,\\n                0,\\n                0,\\n                recipient,\\n                block.timestamp\\n            );\\n            return liquidity;\\n        } else {\\n            // go through native token for highest liquidity\\n            uint256 nativeAmount = _swapTokenForNative(\\n                _from,\\n                amount,\\n                address(this),\\n                routerAddr\\n            );\\n            return _swapNativeToLP(_to, nativeAmount, recipient, routerAddr);\\n        }\\n    }\\n\\n    function _swapNativeToLP(\\n        address _LP,\\n        uint256 amount,\\n        address recipient,\\n        address routerAddress\\n    ) private returns (uint256) {\\n        // LP\\n        IUniswapV2Pair pair = IUniswapV2Pair(_LP);\\n        address token0 = pair.token0();\\n        address token1 = pair.token1();\\n        uint256 liquidity;\\n        if (token0 == WNATIVE || token1 == WNATIVE) {\\n            address token = token0 == WNATIVE ? token1 : token0;\\n            (, , liquidity) = _swapHalfNativeAndProvide(\\n                token,\\n                amount,\\n                routerAddress,\\n                recipient\\n            );\\n        } else {\\n            (, , liquidity) = _swapNativeToEqualTokensAndProvide(\\n                token0,\\n                token1,\\n                amount,\\n                routerAddress,\\n                recipient\\n            );\\n        }\\n        return liquidity;\\n    }\\n\\n    function _swapHalfNativeAndProvide(\\n        address token,\\n        uint256 amount,\\n        address routerAddress,\\n        address recipient\\n    )\\n        private\\n        returns (\\n            uint256,\\n            uint256,\\n            uint256\\n        )\\n    {\\n        uint256 swapValue = amount.div(2);\\n        uint256 tokenAmount = _swapNativeForToken(\\n            token,\\n            swapValue,\\n            address(this),\\n            routerAddress\\n        );\\n        _approveTokenIfNeeded(token, routerAddress);\\n        if (useNativeRouter[routerAddress]) {\\n            IHyperswapRouter01 router = IHyperswapRouter01(routerAddress);\\n            return\\n                router.addLiquidityFTM{value: amount.sub(swapValue)}(\\n                    token,\\n                    tokenAmount,\\n                    0,\\n                    0,\\n                    recipient,\\n                    block.timestamp\\n                );\\n        } else {\\n            IUniswapV2Router01 router = IUniswapV2Router01(routerAddress);\\n            return\\n                router.addLiquidityETH{value: amount.sub(swapValue)}(\\n                    token,\\n                    tokenAmount,\\n                    0,\\n                    0,\\n                    recipient,\\n                    block.timestamp\\n                );\\n        }\\n    }\\n\\n    function _swapNativeToEqualTokensAndProvide(\\n        address token0,\\n        address token1,\\n        uint256 amount,\\n        address routerAddress,\\n        address recipient\\n    )\\n        private\\n        returns (\\n            uint256,\\n            uint256,\\n            uint256\\n        )\\n    {\\n        uint256 swapValue = amount.div(2);\\n        uint256 token0Amount = _swapNativeForToken(\\n            token0,\\n            swapValue,\\n            address(this),\\n            routerAddress\\n        );\\n        uint256 token1Amount = _swapNativeForToken(\\n            token1,\\n            amount.sub(swapValue),\\n            address(this),\\n            routerAddress\\n        );\\n        _approveTokenIfNeeded(token0, routerAddress);\\n        _approveTokenIfNeeded(token1, routerAddress);\\n        IUniswapV2Router01 router = IUniswapV2Router01(routerAddress);\\n        return\\n            router.addLiquidity(\\n                token0,\\n                token1,\\n                token0Amount,\\n                token1Amount,\\n                0,\\n                0,\\n                recipient,\\n                block.timestamp\\n            );\\n    }\\n\\n    function _swapNativeForToken(\\n        address token,\\n        uint256 value,\\n        address recipient,\\n        address routerAddr\\n    ) private returns (uint256) {\\n        address[] memory path;\\n        IUniswapV2Router01 router = IUniswapV2Router01(routerAddr);\\n\\n        if (tokenBridgeForRouter[token][routerAddr] != address(0)) {\\n            path = new address[](3);\\n            path[0] = WNATIVE;\\n            path[1] = tokenBridgeForRouter[token][routerAddr];\\n            path[2] = token;\\n        } else {\\n            path = new address[](2);\\n            path[0] = WNATIVE;\\n            path[1] = token;\\n        }\\n\\n        uint256[] memory amounts = router.swapExactETHForTokens{value: value}(\\n            0,\\n            path,\\n            recipient,\\n            block.timestamp\\n        );\\n        return amounts[amounts.length - 1];\\n    }\\n\\n    function _swapTokenForNative(\\n        address token,\\n        uint256 amount,\\n        address recipient,\\n        address routerAddr\\n    ) private returns (uint256) {\\n        address[] memory path;\\n        IUniswapV2Router01 router = IUniswapV2Router01(routerAddr);\\n\\n        if (tokenBridgeForRouter[token][routerAddr] != address(0)) {\\n            path = new address[](3);\\n            path[0] = token;\\n            path[1] = tokenBridgeForRouter[token][routerAddr];\\n            path[2] = router.WETH();\\n        } else {\\n            path = new address[](2);\\n            path[0] = token;\\n            path[1] = router.WETH();\\n        }\\n\\n        if (isFeeOnTransfer[token]) {\\n            router.swapExactTokensForETHSupportingFeeOnTransferTokens(\\n                amount,\\n                0,\\n                path,\\n                recipient,\\n                block.timestamp\\n            );\\n            return IERC20(token).balanceOf(address(this));\\n        } else {\\n            uint256[] memory amounts = router.swapExactTokensForETH(\\n                amount,\\n                0,\\n                path,\\n                recipient,\\n                block.timestamp\\n            );\\n            return amounts[amounts.length - 1];\\n        }\\n    }\\n\\n    function _swap(\\n        address _from,\\n        uint256 amount,\\n        address _to,\\n        address recipient,\\n        address routerAddr\\n    ) private returns (uint256) {\\n        IUniswapV2Router01 router = IUniswapV2Router01(routerAddr);\\n\\n        address fromBridge = tokenBridgeForRouter[_from][routerAddr];\\n        address toBridge = tokenBridgeForRouter[_to][routerAddr];\\n\\n        address[] memory path;\\n\\n        if (fromBridge != address(0) && toBridge != address(0)) {\\n            // both have bridge\\n            if (fromBridge != toBridge) {\\n                path = new address[](5);\\n                path[0] = _from;\\n                path[1] = fromBridge;\\n                path[2] = WNATIVE;\\n                path[3] = toBridge;\\n                path[4] = _to;\\n            } else {\\n                path = new address[](3);\\n                path[0] = _from;\\n                path[1] = fromBridge;\\n                path[2] = _to;\\n            }\\n        } else if (fromBridge != address(0)) {\\n            // from has bridge\\n            if (fromBridge == _to) {\\n                path = new address[](2);\\n                path[0] = _from;\\n                path[1] = _to;\\n            } else if (_to == WNATIVE) {\\n                path = new address[](3);\\n                path[0] = _from;\\n                path[1] = fromBridge;\\n                path[2] = WNATIVE;\\n            } else {\\n                path = new address[](4);\\n                path[0] = _from;\\n                path[1] = fromBridge;\\n                path[2] = WNATIVE;\\n                path[3] = _to;\\n            }\\n        } else if (toBridge != address(0)) {\\n            // only _to ha a bridge, not _from\\n            if (_from == toBridge) {\\n                path = new address[](2);\\n                path[0] = _from;\\n                path[1] = _to;\\n            } else if (_from == WNATIVE) {\\n                path = new address[](3);\\n                path[0] = WNATIVE;\\n                path[1] = toBridge;\\n                path[2] = _to;\\n            } else {\\n                path = new address[](4);\\n                path[0] = _from;\\n                path[1] = WNATIVE;\\n                path[2] = toBridge;\\n                path[3] = _to;\\n            }\\n        } else if (_from == WNATIVE || _to == WNATIVE) {\\n            path = new address[](2);\\n            path[0] = _from;\\n            path[1] = _to;\\n        } else {\\n            // Go through WNative\\n            path = new address[](3);\\n            path[0] = _from;\\n            path[1] = WNATIVE;\\n            path[2] = _to;\\n        }\\n\\n        uint256[] memory amounts;\\n\\n        if (isFeeOnTransfer[_from]) {\\n            router.swapExactTokensForTokensSupportingFeeOnTransferTokens(\\n                amount,\\n                0,\\n                path,\\n                recipient,\\n                block.timestamp\\n            );\\n            return IERC20(_to).balanceOf(address(this));\\n        } else {\\n            amounts = router.swapExactTokensForTokens(\\n                amount,\\n                0,\\n                path,\\n                recipient,\\n                block.timestamp\\n            );\\n        }\\n\\n        return amounts[amounts.length - 1];\\n    }\\n\\n    function _estimateSwap(\\n        address _from,\\n        uint256 amount,\\n        address _to,\\n        address routerAddr\\n    ) private view returns (uint256) {\\n        IUniswapV2Router01 router = IUniswapV2Router01(routerAddr);\\n\\n        address fromBridge = tokenBridgeForRouter[_from][routerAddr];\\n        address toBridge = tokenBridgeForRouter[_to][routerAddr];\\n\\n        address[] memory path;\\n\\n        if (fromBridge != address(0) && toBridge != address(0)) {\\n            if (fromBridge != toBridge) {\\n                path = new address[](5);\\n                path[0] = _from;\\n                path[1] = fromBridge;\\n                path[2] = WNATIVE;\\n                path[3] = toBridge;\\n                path[4] = _to;\\n            } else {\\n                path = new address[](3);\\n                path[0] = _from;\\n                path[1] = fromBridge;\\n                path[2] = _to;\\n            }\\n        } else if (fromBridge != address(0)) {\\n            if (fromBridge == _to) {\\n                path = new address[](2);\\n                path[0] = _from;\\n                path[1] = _to;\\n            } else if (_to == WNATIVE) {\\n                path = new address[](3);\\n                path[0] = _from;\\n                path[1] = fromBridge;\\n                path[2] = WNATIVE;\\n            } else {\\n                path = new address[](4);\\n                path[0] = _from;\\n                path[1] = fromBridge;\\n                path[2] = WNATIVE;\\n                path[3] = _to;\\n            }\\n        } else if (toBridge != address(0)) {\\n            if (_from == toBridge) {\\n                path = new address[](2);\\n                path[0] = _from;\\n                path[1] = _to;\\n            } else if (_from == WNATIVE) {\\n                path = new address[](3);\\n                path[0] = WNATIVE;\\n                path[1] = toBridge;\\n                path[2] = _to;\\n            } else {\\n                path = new address[](4);\\n                path[0] = _from;\\n                path[1] = WNATIVE;\\n                path[2] = toBridge;\\n                path[3] = _to;\\n            }\\n        } else if (_from == WNATIVE || _to == WNATIVE) {\\n            path = new address[](2);\\n            path[0] = _from;\\n            path[1] = _to;\\n        } else {\\n            // Go through WNative\\n            path = new address[](3);\\n            path[0] = _from;\\n            path[1] = WNATIVE;\\n            path[2] = _to;\\n        }\\n\\n        uint256[] memory amounts = router.getAmountsOut(amount, path);\\n        return amounts[amounts.length - 1];\\n    }\\n\\n    /* ========== RESTRICTED FUNCTIONS ========== */\\n\\n    function setTokenBridgeForRouter(\\n        address token,\\n        address router,\\n        address bridgeToken\\n    ) external onlyOwner {\\n        tokenBridgeForRouter[token][router] = bridgeToken;\\n    }\\n\\n    function withdraw(address token) external onlyOwner {\\n        if (token == address(0)) {\\n            payable(owner()).transfer(address(this).balance);\\n            return;\\n        }\\n\\n        IERC20(token).transfer(owner(), IERC20(token).balanceOf(address(this)));\\n    }\\n\\n    function setUseNativeRouter(address router) external onlyOwner {\\n        useNativeRouter[router] = true;\\n    }\\n\\n    function setIsFeeOnTransfer(address token) external onlyOwner {\\n        isFeeOnTransfer[token] = true;\\n    }\\n}\\n\",\"keccak256\":\"0xdd53b87a36a8beb0fdcc089d23b54847e7b4c8d7d98a34ddfbd0693a69c3e95a\",\"license\":\"MIT\"}},\"version\":1}",
  "bytecode": "0x60806040523480156200001157600080fd5b50604051620041183803806200411883398101604081905262000034916200009b565b600080546001600160a01b031916339081178255604051909182917f8be0079c531659141344cd1fd0a4f28419497f9722a3daafe3b4186f6b6457e0908290a350600180546001600160a01b0319166001600160a01b0392909216919091179055620000cd565b600060208284031215620000ae57600080fd5b81516001600160a01b0381168114620000c657600080fd5b9392505050565b61403b80620000dd6000396000f3fe6080604052600436106101125760003560e01c806388fbe419116100a55780639416cbc611610074578063caaae7f511610059578063caaae7f51461030a578063cee6202c1461033a578063f2fde38b1461035a57600080fd5b80639416cbc6146102aa578063ba2ebf96146102ea57600080fd5b806388fbe4191461020857806389fecbd5146102285780638da5cb5b146102485780638e8d81521461027557600080fd5b80635424888b116100e15780635424888b146101935780635cc7647c146101b3578063715018a6146101d357806388f61f9f146101e857600080fd5b8063104bfe551461011e5780631b71afbd1461014057806335e8b7d51461016057806351cff8d91461017357600080fd5b3661011957005b600080fd5b34801561012a57600080fd5b5061013e610139366004613b5e565b61037a565b005b34801561014c57600080fd5b5061013e61015b366004613b7b565b6103fd565b61013e61016e366004613be3565b610610565b34801561017f57600080fd5b5061013e61018e366004613b5e565b610632565b34801561019f57600080fd5b5061013e6101ae366004613be3565b6107d3565b3480156101bf57600080fd5b5061013e6101ce366004613c2e565b610877565b3480156101df57600080fd5b5061013e610b55565b3480156101f457600080fd5b5061013e610203366004613c2e565b610c06565b34801561021457600080fd5b5061013e610223366004613b5e565b610eeb565b34801561023457600080fd5b5061013e610243366004613c2e565b610f69565b34801561025457600080fd5b506000546040516001600160a01b0390911681526020015b60405180910390f35b34801561028157600080fd5b50610295610290366004613c81565b610f9b565b6040805192835260208301919091520161026c565b3480156102b657600080fd5b506102da6102c5366004613b5e565b60046020526000908152604090205460ff1681565b604051901515815260200161026c565b3480156102f657600080fd5b5061013e610305366004613b7b565b611500565b34801561031657600080fd5b506102da610325366004613b5e565b60036020526000908152604090205460ff1681565b34801561034657600080fd5b5061013e610355366004613b7b565b61152c565b34801561036657600080fd5b5061013e610375366004613b5e565b611677565b6000546001600160a01b031633146103d95760405162461bcd60e51b815260206004820181905260248201527f4f776e61626c653a2063616c6c6572206973206e6f7420746865206f776e657260448201526064015b60405180910390fd5b6001600160a01b03166000908152600360205260409020805460ff19166001179055565b6104126001600160a01b0386163330876117b5565b61041c858361183b565b6000856001600160a01b0316630dfe16816040518163ffffffff1660e01b8152600401602060405180830381865afa15801561045c573d6000803e3d6000fd5b505050506040513d601f19601f820116820180604052508101906104809190613cd2565b90506000866001600160a01b031663d21220a76040518163ffffffff1660e01b8152600401602060405180830381865afa1580156104c2573d6000803e3d6000fd5b505050506040513d601f19601f820116820180604052508101906104e69190613cd2565b90506104f2828561183b565b6104fc818561183b565b604051635d5155ef60e11b81526001600160a01b038381166004830152828116602483015260448201889052600060648301819052608483018190523060a48401524260c484015291829187169063baa2abde9060e40160408051808303816000875af1158015610571573d6000803e3d6000fd5b505050506040513d601f19601f820116820180604052508101906105959190613cef565b90925090506001600160a01b03848116908816146105bd576105ba848389308a6118c8565b91505b866001600160a01b0316836001600160a01b0316146105e6576105e3838289308a6118c8565b90505b610605856105f4848461214f565b6001600160a01b038a169190612164565b505050505050505050565b61061c833483856121ad565b50471561062d5761062d334761230a565b505050565b6000546001600160a01b0316331461068c5760405162461bcd60e51b815260206004820181905260248201527f4f776e61626c653a2063616c6c6572206973206e6f7420746865206f776e657260448201526064016103d0565b6001600160a01b0381166106d857600080546040516001600160a01b03909116914780156108fc02929091818181858888f193505050501580156106d4573d6000803e3d6000fd5b5050565b806001600160a01b031663a9059cbb6106f96000546001600160a01b031690565b6040516370a0823160e01b81523060048201526001600160a01b038516906370a0823190602401602060405180830381865afa15801561073d573d6000803e3d6000fd5b505050506040513d601f19601f820116820180604052508101906107619190613d13565b6040516001600160e01b031960e085901b1681526001600160a01b03909216600483015260248201526044016020604051808303816000875af11580156107ac573d6000803e3d6000fd5b505050506040513d601f19601f820116820180604052508101906106d49190613d2c565b50565b6000546001600160a01b0316331461082d5760405162461bcd60e51b815260206004820181905260248201527f4f776e61626c653a2063616c6c6572206973206e6f7420746865206f776e657260448201526064016103d0565b6001600160a01b039283166000908152600260209081526040808320948616835293905291909120805473ffffffffffffffffffffffffffffffffffffffff191691909216179055565b61088c6001600160a01b0385163330866117b5565b610896848361183b565b6000846001600160a01b0316630dfe16816040518163ffffffff1660e01b8152600401602060405180830381865afa1580156108d6573d6000803e3d6000fd5b505050506040513d601f19601f820116820180604052508101906108fa9190613cd2565b90506000856001600160a01b031663d21220a76040518163ffffffff1660e01b8152600401602060405180830381865afa15801561093c573d6000803e3d6000fd5b505050506040513d601f19601f820116820180604052508101906109609190613cd2565b905061096c828561183b565b610976818561183b565b6001546001600160a01b038381169116148061099f57506001546001600160a01b038281169116145b15610a96576001546000906001600160a01b03908116908416036109c357816109c5565b825b6040517f02751cec0000000000000000000000000000000000000000000000000000000081526001600160a01b03808316600483015260248201899052600060448301819052606483018190523060848401524260a48401529293508291908816906302751cec9060c40160408051808303816000875af1158015610a4e573d6000803e3d6000fd5b505050506040513d601f19601f82011682018060405250810190610a729190613cef565b9092509050610a838383888a6123ed565b50610a8e868261230a565b505050610b4d565b604051635d5155ef60e11b81526001600160a01b038381166004830152828116602483015260448201879052600060648301819052608483018190523060a48401524260c484015291829187169063baa2abde9060e40160408051808303816000875af1158015610b0b573d6000803e3d6000fd5b505050506040513d601f19601f82011682018060405250810190610b2f9190613cef565b9092509050610b40848387896123ed565b50610605838287896123ed565b505050505050565b6000546001600160a01b03163314610baf5760405162461bcd60e51b815260206004820181905260248201527f4f776e61626c653a2063616c6c6572206973206e6f7420746865206f776e657260448201526064016103d0565b600080546040516001600160a01b03909116907f8be0079c531659141344cd1fd0a4f28419497f9722a3daafe3b4186f6b6457e0908390a36000805473ffffffffffffffffffffffffffffffffffffffff19169055565b610c1b6001600160a01b0385163330866117b5565b6000849050610c8b816001600160a01b0316630dfe16816040518163ffffffff1660e01b8152600401602060405180830381865afa158015610c61573d6000803e3d6000fd5b505050506040513d601f19601f82011682018060405250810190610c859190613cd2565b8461183b565b610ccc816001600160a01b031663d21220a76040518163ffffffff1660e01b8152600401602060405180830381865afa158015610c61573d6000803e3d6000fd5b610ce06001600160a01b0386168686612164565b6040517f89afcb4400000000000000000000000000000000000000000000000000000000815230600482015260009081906001600160a01b038416906389afcb449060240160408051808303816000875af1158015610d43573d6000803e3d6000fd5b505050506040513d601f19601f82011682018060405250810190610d679190613cef565b8092508193505050846001600160a01b031663e8e33700846001600160a01b0316630dfe16816040518163ffffffff1660e01b8152600401602060405180830381865afa158015610dbc573d6000803e3d6000fd5b505050506040513d601f19601f82011682018060405250810190610de09190613cd2565b856001600160a01b031663d21220a76040518163ffffffff1660e01b8152600401602060405180830381865afa158015610e1e573d6000803e3d6000fd5b505050506040513d601f19601f82011682018060405250810190610e429190613cd2565b6040516001600160e01b031960e085901b1681526001600160a01b0392831660048201529082166024820152604481018690526064810185905260006084820181905260a482015290871660c48201524260e4820152610104016060604051808303816000875af1158015610ebb573d6000803e3d6000fd5b505050506040513d601f19601f82011682018060405250810190610edf9190613d4e565b50505050505050505050565b6000546001600160a01b03163314610f455760405162461bcd60e51b815260206004820181905260248201527f4f776e61626c653a2063616c6c6572206973206e6f7420746865206f776e657260448201526064016103d0565b6001600160a01b03166000908152600460205260409020805460ff19166001179055565b610f7e6001600160a01b0385163330866117b5565b610f88848361183b565b610f94848483856123ed565b5050505050565b600080846001600160a01b0316630dfe16816040518163ffffffff1660e01b8152600401602060405180830381865afa158015610fdc573d6000803e3d6000fd5b505050506040513d601f19601f820116820180604052508101906110009190613cd2565b6001600160a01b0316866001600160a01b031614806110915750846001600160a01b031663d21220a76040518163ffffffff1660e01b8152600401602060405180830381865afa158015611058573d6000803e3d6000fd5b505050506040513d601f19601f8201168201806040525081019061107c9190613cd2565b6001600160a01b0316866001600160a01b0316145b1561128d576000856001600160a01b0316630dfe16816040518163ffffffff1660e01b8152600401602060405180830381865afa1580156110d6573d6000803e3d6000fd5b505050506040513d601f19601f820116820180604052508101906110fa9190613cd2565b6001600160a01b0316876001600160a01b03161461117957856001600160a01b0316630dfe16816040518163ffffffff1660e01b8152600401602060405180830381865afa158015611150573d6000803e3d6000fd5b505050506040513d601f19601f820116820180604052508101906111749190613cd2565b6111db565b856001600160a01b031663d21220a76040518163ffffffff1660e01b8152600401602060405180830381865afa1580156111b7573d6000803e3d6000fd5b505050506040513d601f19601f820116820180604052508101906111db9190613cd2565b905060006111ea856002612823565b905060006111fa8983858a61282f565b9050876001600160a01b0316630dfe16816040518163ffffffff1660e01b8152600401602060405180830381865afa15801561123a573d6000803e3d6000fd5b505050506040513d601f19601f8201168201806040525081019061125e9190613cd2565b6001600160a01b0316896001600160a01b0316036112825790935091506114f79050565b935091506114f79050565b6001546000906001600160a01b038881169116146112c4576001546112bf90889086906001600160a01b03168861282f565b6112c6565b835b9050856001600160a01b0316630dfe16816040518163ffffffff1660e01b8152600401602060405180830381865afa158015611306573d6000803e3d6000fd5b505050506040513d601f19601f8201168201806040525081019061132a9190613cd2565b6001546001600160a01b039182169116036113d75761134a816002612823565b6001546113cd906001600160a01b0316611365846002612823565b896001600160a01b031663d21220a76040518163ffffffff1660e01b8152600401602060405180830381865afa1580156113a3573d6000803e3d6000fd5b505050506040513d601f19601f820116820180604052508101906113c79190613cd2565b8961282f565b92509250506114f7565b856001600160a01b031663d21220a76040518163ffffffff1660e01b8152600401602060405180830381865afa158015611415573d6000803e3d6000fd5b505050506040513d601f19601f820116820180604052508101906114399190613cd2565b6001546001600160a01b039182169116036114dc576001546114d1906001600160a01b0316611469836002612823565b886001600160a01b0316630dfe16816040518163ffffffff1660e01b8152600401602060405180830381865afa1580156114a7573d6000803e3d6000fd5b505050506040513d601f19601f820116820180604052508101906114cb9190613cd2565b8861282f565b6113cd826002612823565b60015461134a906001600160a01b0316611469836002612823565b94509492505050565b6115156001600160a01b0386163330876117b5565b61151f858361183b565b610b4d85858584866118c8565b611536858361183b565b6001600160a01b03851660009081526003602052604090205460ff161561164b576040516323b872dd60e01b8152336004820152306024820152604481018590526001600160a01b038616906323b872dd906064016020604051808303816000875af11580156115aa573d6000803e3d6000fd5b505050506040513d601f19601f820116820180604052508101906115ce9190613d2c565b506040516370a0823160e01b81523060048201526116459086906001600160a01b038216906370a0823190602401602060405180830381865afa158015611619573d6000803e3d6000fd5b505050506040513d601f19601f8201168201806040525081019061163d9190613d13565b858486612f96565b50610f94565b6116606001600160a01b0386163330876117b5565b61166a858361183b565b6116458585858486612f96565b6000546001600160a01b031633146116d15760405162461bcd60e51b815260206004820181905260248201527f4f776e61626c653a2063616c6c6572206973206e6f7420746865206f776e657260448201526064016103d0565b6001600160a01b03811661174d5760405162461bcd60e51b815260206004820152602660248201527f4f776e61626c653a206e6577206f776e657220697320746865207a65726f206160448201527f646472657373000000000000000000000000000000000000000000000000000060648201526084016103d0565b600080546040516001600160a01b03808516939216917f8be0079c531659141344cd1fd0a4f28419497f9722a3daafe3b4186f6b6457e091a36000805473ffffffffffffffffffffffffffffffffffffffff19166001600160a01b0392909216919091179055565b6040516001600160a01b03808516602483015283166044820152606481018290526118359085906323b872dd60e01b906084015b60408051601f198184030181529190526020810180517bffffffffffffffffffffffffffffffffffffffffffffffffffffffff166001600160e01b0319909316929092179091526132eb565b50505050565b604051636eb1769f60e11b81523060048201526001600160a01b03828116602483015283169063dd62ed3e90604401602060405180830381865afa158015611887573d6000803e3d6000fd5b505050506040513d601f19601f820116820180604052508101906118ab9190613d13565b6000036106d4576106d46001600160a01b038316826000196133d0565b6001600160a01b0380861660009081526002602081815260408084208587168086529083528185205489871686529383528185209085529091528220549192849291811691166060821580159061192757506001600160a01b03821615155b15611b0957816001600160a01b0316836001600160a01b031614611a6c5760408051600580825260c08201909252906020820160a080368337019050509050898160008151811061197a5761197a613d92565b60200260200101906001600160a01b031690816001600160a01b03168152505082816001815181106119ae576119ae613d92565b6001600160a01b0392831660209182029290920101526001548251911690829060029081106119df576119df613d92565b60200260200101906001600160a01b031690816001600160a01b0316815250508181600381518110611a1357611a13613d92565b60200260200101906001600160a01b031690816001600160a01b0316815250508781600481518110611a4757611a47613d92565b60200260200101906001600160a01b031690816001600160a01b031681525050611f68565b6040805160038082526080820190925290602082016060803683370190505090508981600081518110611aa157611aa1613d92565b60200260200101906001600160a01b031690816001600160a01b0316815250508281600181518110611ad557611ad5613d92565b60200260200101906001600160a01b031690816001600160a01b0316815250508781600281518110611a4757611a47613d92565b6001600160a01b03831615611d2657876001600160a01b0316836001600160a01b031603611ba85760025b604051908082528060200260200182016040528015611b5d578160200160208202803683370190505b5090508981600081518110611b7457611b74613d92565b60200260200101906001600160a01b031690816001600160a01b0316815250508781600181518110611a4757611a47613d92565b6001546001600160a01b0390811690891603611c58576040805160038082526080820190925290602082016060803683370190505090508981600081518110611bf357611bf3613d92565b60200260200101906001600160a01b031690816001600160a01b0316815250508281600181518110611c2757611c27613d92565b6001600160a01b039283166020918202929092010152600154825191169082906002908110611a4757611a47613d92565b60408051600480825260a0820190925290602082016080803683370190505090508981600081518110611c8d57611c8d613d92565b60200260200101906001600160a01b031690816001600160a01b0316815250508281600181518110611cc157611cc1613d92565b6001600160a01b039283166020918202929092010152600154825191169082906002908110611cf257611cf2613d92565b60200260200101906001600160a01b031690816001600160a01b0316815250508781600381518110611a4757611a47613d92565b6001600160a01b03821615611e7957816001600160a01b03168a6001600160a01b031603611d55576002611b34565b6001546001600160a01b03908116908b1603611de057604080516003808252608082019092529060208201606080368337505060015482519293506001600160a01b031691839150600090611dac57611dac613d92565b60200260200101906001600160a01b031690816001600160a01b0316815250508181600181518110611ad557611ad5613d92565b60408051600480825260a0820190925290602082016080803683370190505090508981600081518110611e1557611e15613d92565b6001600160a01b0392831660209182029290920101526001805483519216918391908110611e4557611e45613d92565b60200260200101906001600160a01b031690816001600160a01b0316815250508181600281518110611cf257611cf2613d92565b6001546001600160a01b038b811691161480611ea257506001546001600160a01b038981169116145b15611eae576002611b34565b6040805160038082526080820190925290602082016060803683370190505090508981600081518110611ee357611ee3613d92565b6001600160a01b0392831660209182029290920101526001805483519216918391908110611f1357611f13613d92565b60200260200101906001600160a01b031690816001600160a01b0316815250508781600281518110611f4757611f47613d92565b60200260200101906001600160a01b031690816001600160a01b0316815250505b6001600160a01b038a1660009081526003602052604090205460609060ff1615612080576040517f5c11d7950000000000000000000000000000000000000000000000000000000081526001600160a01b03861690635c11d79590611fda908d9060009087908e904290600401613dec565b600060405180830381600087803b158015611ff457600080fd5b505af1158015612008573d6000803e3d6000fd5b50506040516370a0823160e01b81523060048201526001600160a01b038c1692506370a082319150602401602060405180830381865afa158015612050573d6000803e3d6000fd5b505050506040513d601f19601f820116820180604052508101906120749190613d13565b95505050505050612146565b6040517f38ed17390000000000000000000000000000000000000000000000000000000081526001600160a01b038616906338ed1739906120ce908d9060009087908e904290600401613dec565b6000604051808303816000875af11580156120ed573d6000803e3d6000fd5b505050506040513d6000823e601f3d908101601f191682016040526121159190810190613e28565b905080600182516121269190613efc565b8151811061213657612136613d92565b6020026020010151955050505050505b95945050505050565b600061215b8284613f0f565b90505b92915050565b6040516001600160a01b03831660248201526044810182905261062d9084907fa9059cbb00000000000000000000000000000000000000000000000000000000906064016117e9565b6000808590506000816001600160a01b0316630dfe16816040518163ffffffff1660e01b8152600401602060405180830381865afa1580156121f3573d6000803e3d6000fd5b505050506040513d601f19601f820116820180604052508101906122179190613cd2565b90506000826001600160a01b031663d21220a76040518163ffffffff1660e01b8152600401602060405180830381865afa158015612259573d6000803e3d6000fd5b505050506040513d601f19601f8201168201806040525081019061227d9190613cd2565b6001549091506000906001600160a01b03848116911614806122ac57506001546001600160a01b038381169116145b156122ea576001546000906001600160a01b038581169116146122cf57836122d1565b825b90506122df818a898b613505565b93506122fc92505050565b6122f783838a898b61362a565b925050505b93505050505b949350505050565b604080516000808252602082019092526001600160a01b0384169083906040516123349190613f46565b60006040518083038185875af1925050503d8060008114612371576040519150601f19603f3d011682016040523d82523d6000602084013e612376565b606091505b505090508061062d5760405162461bcd60e51b815260206004820152602360248201527f5472616e7366657248656c7065723a204554485f5452414e534645525f46414960448201527f4c4544000000000000000000000000000000000000000000000000000000000060648201526084016103d0565b6001600160a01b038481166000908152600260209081526040808320848616845290915281205490916060918491161561255d57604080516003808252608082019092529060208201606080368337019050509150868260008151811061245657612456613d92565b6001600160a01b039283166020918202929092018101919091528882166000908152600282526040808220888516835290925220548351911690839060019081106124a3576124a3613d92565b60200260200101906001600160a01b031690816001600160a01b031681525050806001600160a01b031663ad5c46486040518163ffffffff1660e01b8152600401602060405180830381865afa158015612501573d6000803e3d6000fd5b505050506040513d601f19601f820116820180604052508101906125259190613cd2565b8260028151811061253857612538613d92565b60200260200101906001600160a01b031690816001600160a01b031681525050612647565b6040805160028082526060820183529091602083019080368337019050509150868260008151811061259157612591613d92565b60200260200101906001600160a01b031690816001600160a01b031681525050806001600160a01b031663ad5c46486040518163ffffffff1660e01b8152600401602060405180830381865afa1580156125ef573d6000803e3d6000fd5b505050506040513d601f19601f820116820180604052508101906126139190613cd2565b8260018151811061262657612626613d92565b60200260200101906001600160a01b031690816001600160a01b0316815250505b6001600160a01b03871660009081526003602052604090205460ff1615612759576040517f791ac9470000000000000000000000000000000000000000000000000000000081526001600160a01b0382169063791ac947906126b690899060009087908b904290600401613dec565b600060405180830381600087803b1580156126d057600080fd5b505af11580156126e4573d6000803e3d6000fd5b50506040516370a0823160e01b81523060048201526001600160a01b038a1692506370a082319150602401602060405180830381865afa15801561272c573d6000803e3d6000fd5b505050506040513d601f19601f820116820180604052508101906127509190613d13565b92505050612302565b6040517f18cbafe50000000000000000000000000000000000000000000000000000000081526000906001600160a01b038316906318cbafe5906127a9908a90859088908c904290600401613dec565b6000604051808303816000875af11580156127c8573d6000803e3d6000fd5b505050506040513d6000823e601f3d908101601f191682016040526127f09190810190613e28565b905080600182516128019190613efc565b8151811061281157612811613d92565b60200260200101519350505050612302565b600061215b8284613f62565b6001600160a01b0380851660009081526002602081815260408084208587168086529083528185205488871686529383528185209085529091528220549192849291811691166060821580159061288e57506001600160a01b03821615155b15612a7057816001600160a01b0316836001600160a01b0316146129d35760408051600580825260c08201909252906020820160a08036833701905050905088816000815181106128e1576128e1613d92565b60200260200101906001600160a01b031690816001600160a01b031681525050828160018151811061291557612915613d92565b6001600160a01b03928316602091820292909201015260015482519116908290600290811061294657612946613d92565b60200260200101906001600160a01b031690816001600160a01b031681525050818160038151811061297a5761297a613d92565b60200260200101906001600160a01b031690816001600160a01b03168152505086816004815181106129ae576129ae613d92565b60200260200101906001600160a01b031690816001600160a01b031681525050612ecf565b6040805160038082526080820190925290602082016060803683370190505090508881600081518110612a0857612a08613d92565b60200260200101906001600160a01b031690816001600160a01b0316815250508281600181518110612a3c57612a3c613d92565b60200260200101906001600160a01b031690816001600160a01b03168152505086816002815181106129ae576129ae613d92565b6001600160a01b03831615612c8d57866001600160a01b0316836001600160a01b031603612b0f5760025b604051908082528060200260200182016040528015612ac4578160200160208202803683370190505b5090508881600081518110612adb57612adb613d92565b60200260200101906001600160a01b031690816001600160a01b03168152505086816001815181106129ae576129ae613d92565b6001546001600160a01b0390811690881603612bbf576040805160038082526080820190925290602082016060803683370190505090508881600081518110612b5a57612b5a613d92565b60200260200101906001600160a01b031690816001600160a01b0316815250508281600181518110612b8e57612b8e613d92565b6001600160a01b0392831660209182029290920101526001548251911690829060029081106129ae576129ae613d92565b60408051600480825260a0820190925290602082016080803683370190505090508881600081518110612bf457612bf4613d92565b60200260200101906001600160a01b031690816001600160a01b0316815250508281600181518110612c2857612c28613d92565b6001600160a01b039283166020918202929092010152600154825191169082906002908110612c5957612c59613d92565b60200260200101906001600160a01b031690816001600160a01b03168152505086816003815181106129ae576129ae613d92565b6001600160a01b03821615612de057816001600160a01b0316896001600160a01b031603612cbc576002612a9b565b6001546001600160a01b03908116908a1603612d4757604080516003808252608082019092529060208201606080368337505060015482519293506001600160a01b031691839150600090612d1357612d13613d92565b60200260200101906001600160a01b031690816001600160a01b0316815250508181600181518110612a3c57612a3c613d92565b60408051600480825260a0820190925290602082016080803683370190505090508881600081518110612d7c57612d7c613d92565b6001600160a01b0392831660209182029290920101526001805483519216918391908110612dac57612dac613d92565b60200260200101906001600160a01b031690816001600160a01b0316815250508181600281518110612c5957612c59613d92565b6001546001600160a01b038a811691161480612e0957506001546001600160a01b038881169116145b15612e15576002612a9b565b6040805160038082526080820190925290602082016060803683370190505090508881600081518110612e4a57612e4a613d92565b6001600160a01b0392831660209182029290920101526001805483519216918391908110612e7a57612e7a613d92565b60200260200101906001600160a01b031690816001600160a01b0316815250508681600281518110612eae57612eae613d92565b60200260200101906001600160a01b031690816001600160a01b0316815250505b6040517fd06ca61f0000000000000000000000000000000000000000000000000000000081526000906001600160a01b0386169063d06ca61f90612f19908c908690600401613f84565b600060405180830381865afa158015612f36573d6000803e3d6000fd5b505050506040513d6000823e601f3d908101601f19168201604052612f5e9190810190613e28565b90508060018251612f6f9190613efc565b81518110612f7f57612f7f613d92565b602002602001015195505050505050949350505050565b6000836001600160a01b0316630dfe16816040518163ffffffff1660e01b8152600401602060405180830381865afa158015612fd6573d6000803e3d6000fd5b505050506040513d601f19601f82011682018060405250810190612ffa9190613cd2565b6001600160a01b0316866001600160a01b0316148061308b5750836001600160a01b031663d21220a76040518163ffffffff1660e01b8152600401602060405180830381865afa158015613052573d6000803e3d6000fd5b505050506040513d601f19601f820116820180604052508101906130769190613cd2565b6001600160a01b0316866001600160a01b0316145b156132c7576000846001600160a01b0316630dfe16816040518163ffffffff1660e01b8152600401602060405180830381865afa1580156130d0573d6000803e3d6000fd5b505050506040513d601f19601f820116820180604052508101906130f49190613cd2565b6001600160a01b0316876001600160a01b03161461317357846001600160a01b0316630dfe16816040518163ffffffff1660e01b8152600401602060405180830381865afa15801561314a573d6000803e3d6000fd5b505050506040513d601f19601f8201168201806040525081019061316e9190613cd2565b6131d5565b846001600160a01b031663d21220a76040518163ffffffff1660e01b8152600401602060405180830381865afa1580156131b1573d6000803e3d6000fd5b505050506040513d601f19601f820116820180604052508101906131d59190613cd2565b90506131e1818461183b565b60006131ee876002612823565b905060006131ff89838530896118c8565b905060006001600160a01b03861663e8e337008b8661321e8d88613749565b6040516001600160e01b031960e086901b1681526001600160a01b039384166004820152918316602483015260448201526064810186905260006084820181905260a4820152908a1660c48201524260e4820152610104016060604051808303816000875af1158015613295573d6000803e3d6000fd5b505050506040513d601f19601f820116820180604052508101906132b99190613d4e565b965061214695505050505050565b60006132d5878730866123ed565b90506132e3858286866121ad565b915050612146565b6000613340826040518060400160405280602081526020017f5361666545524332303a206c6f772d6c6576656c2063616c6c206661696c6564815250856001600160a01b03166137559092919063ffffffff16565b80519091501561062d578080602001905181019061335e9190613d2c565b61062d5760405162461bcd60e51b815260206004820152602a60248201527f5361666545524332303a204552433230206f7065726174696f6e20646964206e60448201527f6f7420737563636565640000000000000000000000000000000000000000000060648201526084016103d0565b80158061344a5750604051636eb1769f60e11b81523060048201526001600160a01b03838116602483015284169063dd62ed3e90604401602060405180830381865afa158015613424573d6000803e3d6000fd5b505050506040513d601f19601f820116820180604052508101906134489190613d13565b155b6134bc5760405162461bcd60e51b815260206004820152603660248201527f5361666545524332303a20617070726f76652066726f6d206e6f6e2d7a65726f60448201527f20746f206e6f6e2d7a65726f20616c6c6f77616e63650000000000000000000060648201526084016103d0565b6040516001600160a01b03831660248201526044810182905261062d9084907f095ea7b300000000000000000000000000000000000000000000000000000000906064016117e9565b6000808080613515876002612823565b905060006135258983308a61376e565b9050613531898861183b565b6001600160a01b03871660009081526004602052604090205460ff161561360657866001600160a01b03811663d427d12c61356c8b86613749565b6040516001600160e01b031960e084901b1681526001600160a01b03808f1660048301526024820187905260006044830181905260648301528b1660848201524260a482015260c40160606040518083038185885af11580156135d3573d6000803e3d6000fd5b50505050506040513d601f19601f820116820180604052508101906135f89190613d4e565b955095509550505050613620565b866001600160a01b03811663f305d71961356c8b86613749565b9450945094915050565b600080808061363a876002612823565b9050600061364a8a83308a61376e565b905060006136638a61365c8b86613749565b308b61376e565b905061366f8b8961183b565b6136798a8961183b565b6040517fe8e337000000000000000000000000000000000000000000000000000000000081526001600160a01b038c811660048301528b81166024830152604482018490526064820183905260006084830181905260a483015288811660c48301524260e483015289919082169063e8e3370090610104016060604051808303816000875af1158015613710573d6000803e3d6000fd5b505050506040513d601f19601f820116820180604052508101906137349190613d4e565b96509650965050505050955095509592505050565b600061215b8284613efc565b606061376484846000856139d1565b90505b9392505050565b6001600160a01b038481166000908152600260209081526040808320848616845290915281205490916060918491161561388957604080516003808252608082019092529060208201606080368337505060015482519294506001600160a01b0316918491506000906137e3576137e3613d92565b6001600160a01b0392831660209182029290920181019190915288821660009081526002825260408082208885168352909252205483519116908390600190811061383057613830613d92565b60200260200101906001600160a01b031690816001600160a01b031681525050868260028151811061386457613864613d92565b60200260200101906001600160a01b031690816001600160a01b03168152505061391e565b6040805160028082526060820183529091602083019080368337505060015482519294506001600160a01b0316918491506000906138c9576138c9613d92565b60200260200101906001600160a01b031690816001600160a01b03168152505086826001815181106138fd576138fd613d92565b60200260200101906001600160a01b031690816001600160a01b0316815250505b6000816001600160a01b0316637ff36ab5886000868a426040518663ffffffff1660e01b81526004016139549493929190613f9d565b60006040518083038185885af1158015613972573d6000803e3d6000fd5b50505050506040513d6000823e601f3d908101601f1916820160405261399b9190810190613e28565b905080600182516139ac9190613efc565b815181106139bc576139bc613d92565b60200260200101519350505050949350505050565b606082471015613a495760405162461bcd60e51b815260206004820152602660248201527f416464726573733a20696e73756666696369656e742062616c616e636520666f60448201527f722063616c6c000000000000000000000000000000000000000000000000000060648201526084016103d0565b843b613a975760405162461bcd60e51b815260206004820152601d60248201527f416464726573733a2063616c6c20746f206e6f6e2d636f6e747261637400000060448201526064016103d0565b600080866001600160a01b03168587604051613ab39190613f46565b60006040518083038185875af1925050503d8060008114613af0576040519150601f19603f3d011682016040523d82523d6000602084013e613af5565b606091505b5091509150613b05828286613b10565b979650505050505050565b60608315613b1f575081613767565b825115613b2f5782518084602001fd5b8160405162461bcd60e51b81526004016103d09190613fd2565b6001600160a01b03811681146107d057600080fd5b600060208284031215613b7057600080fd5b813561376781613b49565b600080600080600060a08688031215613b9357600080fd5b8535613b9e81613b49565b9450602086013593506040860135613bb581613b49565b92506060860135613bc581613b49565b91506080860135613bd581613b49565b809150509295509295909350565b600080600060608486031215613bf857600080fd5b8335613c0381613b49565b92506020840135613c1381613b49565b91506040840135613c2381613b49565b809150509250925092565b60008060008060808587031215613c4457600080fd5b8435613c4f81613b49565b9350602085013592506040850135613c6681613b49565b91506060850135613c7681613b49565b939692955090935050565b60008060008060808587031215613c9757600080fd5b8435613ca281613b49565b93506020850135613cb281613b49565b92506040850135613cc281613b49565b9396929550929360600135925050565b600060208284031215613ce457600080fd5b815161376781613b49565b60008060408385031215613d0257600080fd5b505080516020909101519092909150565b600060208284031215613d2557600080fd5b5051919050565b600060208284031215613d3e57600080fd5b8151801515811461376757600080fd5b600080600060608486031215613d6357600080fd5b8351925060208401519150604084015190509250925092565b634e487b7160e01b600052604160045260246000fd5b634e487b7160e01b600052603260045260246000fd5b600081518084526020808501945080840160005b83811015613de15781516001600160a01b031687529582019590820190600101613dbc565b509495945050505050565b85815284602082015260a060408201526000613e0b60a0830186613da8565b6001600160a01b0394909416606083015250608001529392505050565b60006020808385031215613e3b57600080fd5b825167ffffffffffffffff80821115613e5357600080fd5b818501915085601f830112613e6757600080fd5b815181811115613e7957613e79613d7c565b8060051b604051601f19603f83011681018181108582111715613e9e57613e9e613d7c565b604052918252848201925083810185019188831115613ebc57600080fd5b938501935b82851015613eda57845184529385019392850192613ec1565b98975050505050505050565b634e487b7160e01b600052601160045260246000fd5b8181038181111561215e5761215e613ee6565b8082018082111561215e5761215e613ee6565b60005b83811015613f3d578181015183820152602001613f25565b50506000910152565b60008251613f58818460208701613f22565b9190910192915050565b600082613f7f57634e487b7160e01b600052601260045260246000fd5b500490565b8281526040602082015260006137646040830184613da8565b848152608060208201526000613fb66080830186613da8565b6001600160a01b03949094166040830152506060015292915050565b6020815260008251806020840152613ff1816040850160208701613f22565b601f01601f1916919091016040019291505056fea2646970667358221220057a2040832e00ee6eb37268908a286f8c6f6995f96463fcf029312be36b551a64736f6c63430008110033",
  "deployedBytecode": "0x6080604052600436106101125760003560e01c806388fbe419116100a55780639416cbc611610074578063caaae7f511610059578063caaae7f51461030a578063cee6202c1461033a578063f2fde38b1461035a57600080fd5b80639416cbc6146102aa578063ba2ebf96146102ea57600080fd5b806388fbe4191461020857806389fecbd5146102285780638da5cb5b146102485780638e8d81521461027557600080fd5b80635424888b116100e15780635424888b146101935780635cc7647c146101b3578063715018a6146101d357806388f61f9f146101e857600080fd5b8063104bfe551461011e5780631b71afbd1461014057806335e8b7d51461016057806351cff8d91461017357600080fd5b3661011957005b600080fd5b34801561012a57600080fd5b5061013e610139366004613b5e565b61037a565b005b34801561014c57600080fd5b5061013e61015b366004613b7b565b6103fd565b61013e61016e366004613be3565b610610565b34801561017f57600080fd5b5061013e61018e366004613b5e565b610632565b34801561019f57600080fd5b5061013e6101ae366004613be3565b6107d3565b3480156101bf57600080fd5b5061013e6101ce366004613c2e565b610877565b3480156101df57600080fd5b5061013e610b55565b3480156101f457600080fd5b5061013e610203366004613c2e565b610c06565b34801561021457600080fd5b5061013e610223366004613b5e565b610eeb565b34801561023457600080fd5b5061013e610243366004613c2e565b610f69565b34801561025457600080fd5b506000546040516001600160a01b0390911681526020015b60405180910390f35b34801561028157600080fd5b50610295610290366004613c81565b610f9b565b6040805192835260208301919091520161026c565b3480156102b657600080fd5b506102da6102c5366004613b5e565b60046020526000908152604090205460ff1681565b604051901515815260200161026c565b3480156102f657600080fd5b5061013e610305366004613b7b565b611500565b34801561031657600080fd5b506102da610325366004613b5e565b60036020526000908152604090205460ff1681565b34801561034657600080fd5b5061013e610355366004613b7b565b61152c565b34801561036657600080fd5b5061013e610375366004613b5e565b611677565b6000546001600160a01b031633146103d95760405162461bcd60e51b815260206004820181905260248201527f4f776e61626c653a2063616c6c6572206973206e6f7420746865206f776e657260448201526064015b60405180910390fd5b6001600160a01b03166000908152600360205260409020805460ff19166001179055565b6104126001600160a01b0386163330876117b5565b61041c858361183b565b6000856001600160a01b0316630dfe16816040518163ffffffff1660e01b8152600401602060405180830381865afa15801561045c573d6000803e3d6000fd5b505050506040513d601f19601f820116820180604052508101906104809190613cd2565b90506000866001600160a01b031663d21220a76040518163ffffffff1660e01b8152600401602060405180830381865afa1580156104c2573d6000803e3d6000fd5b505050506040513d601f19601f820116820180604052508101906104e69190613cd2565b90506104f2828561183b565b6104fc818561183b565b604051635d5155ef60e11b81526001600160a01b038381166004830152828116602483015260448201889052600060648301819052608483018190523060a48401524260c484015291829187169063baa2abde9060e40160408051808303816000875af1158015610571573d6000803e3d6000fd5b505050506040513d601f19601f820116820180604052508101906105959190613cef565b90925090506001600160a01b03848116908816146105bd576105ba848389308a6118c8565b91505b866001600160a01b0316836001600160a01b0316146105e6576105e3838289308a6118c8565b90505b610605856105f4848461214f565b6001600160a01b038a169190612164565b505050505050505050565b61061c833483856121ad565b50471561062d5761062d334761230a565b505050565b6000546001600160a01b0316331461068c5760405162461bcd60e51b815260206004820181905260248201527f4f776e61626c653a2063616c6c6572206973206e6f7420746865206f776e657260448201526064016103d0565b6001600160a01b0381166106d857600080546040516001600160a01b03909116914780156108fc02929091818181858888f193505050501580156106d4573d6000803e3d6000fd5b5050565b806001600160a01b031663a9059cbb6106f96000546001600160a01b031690565b6040516370a0823160e01b81523060048201526001600160a01b038516906370a0823190602401602060405180830381865afa15801561073d573d6000803e3d6000fd5b505050506040513d601f19601f820116820180604052508101906107619190613d13565b6040516001600160e01b031960e085901b1681526001600160a01b03909216600483015260248201526044016020604051808303816000875af11580156107ac573d6000803e3d6000fd5b505050506040513d601f19601f820116820180604052508101906106d49190613d2c565b50565b6000546001600160a01b0316331461082d5760405162461bcd60e51b815260206004820181905260248201527f4f776e61626c653a2063616c6c6572206973206e6f7420746865206f776e657260448201526064016103d0565b6001600160a01b039283166000908152600260209081526040808320948616835293905291909120805473ffffffffffffffffffffffffffffffffffffffff191691909216179055565b61088c6001600160a01b0385163330866117b5565b610896848361183b565b6000846001600160a01b0316630dfe16816040518163ffffffff1660e01b8152600401602060405180830381865afa1580156108d6573d6000803e3d6000fd5b505050506040513d601f19601f820116820180604052508101906108fa9190613cd2565b90506000856001600160a01b031663d21220a76040518163ffffffff1660e01b8152600401602060405180830381865afa15801561093c573d6000803e3d6000fd5b505050506040513d601f19601f820116820180604052508101906109609190613cd2565b905061096c828561183b565b610976818561183b565b6001546001600160a01b038381169116148061099f57506001546001600160a01b038281169116145b15610a96576001546000906001600160a01b03908116908416036109c357816109c5565b825b6040517f02751cec0000000000000000000000000000000000000000000000000000000081526001600160a01b03808316600483015260248201899052600060448301819052606483018190523060848401524260a48401529293508291908816906302751cec9060c40160408051808303816000875af1158015610a4e573d6000803e3d6000fd5b505050506040513d601f19601f82011682018060405250810190610a729190613cef565b9092509050610a838383888a6123ed565b50610a8e868261230a565b505050610b4d565b604051635d5155ef60e11b81526001600160a01b038381166004830152828116602483015260448201879052600060648301819052608483018190523060a48401524260c484015291829187169063baa2abde9060e40160408051808303816000875af1158015610b0b573d6000803e3d6000fd5b505050506040513d601f19601f82011682018060405250810190610b2f9190613cef565b9092509050610b40848387896123ed565b50610605838287896123ed565b505050505050565b6000546001600160a01b03163314610baf5760405162461bcd60e51b815260206004820181905260248201527f4f776e61626c653a2063616c6c6572206973206e6f7420746865206f776e657260448201526064016103d0565b600080546040516001600160a01b03909116907f8be0079c531659141344cd1fd0a4f28419497f9722a3daafe3b4186f6b6457e0908390a36000805473ffffffffffffffffffffffffffffffffffffffff19169055565b610c1b6001600160a01b0385163330866117b5565b6000849050610c8b816001600160a01b0316630dfe16816040518163ffffffff1660e01b8152600401602060405180830381865afa158015610c61573d6000803e3d6000fd5b505050506040513d601f19601f82011682018060405250810190610c859190613cd2565b8461183b565b610ccc816001600160a01b031663d21220a76040518163ffffffff1660e01b8152600401602060405180830381865afa158015610c61573d6000803e3d6000fd5b610ce06001600160a01b0386168686612164565b6040517f89afcb4400000000000000000000000000000000000000000000000000000000815230600482015260009081906001600160a01b038416906389afcb449060240160408051808303816000875af1158015610d43573d6000803e3d6000fd5b505050506040513d601f19601f82011682018060405250810190610d679190613cef565b8092508193505050846001600160a01b031663e8e33700846001600160a01b0316630dfe16816040518163ffffffff1660e01b8152600401602060405180830381865afa158015610dbc573d6000803e3d6000fd5b505050506040513d601f19601f82011682018060405250810190610de09190613cd2565b856001600160a01b031663d21220a76040518163ffffffff1660e01b8152600401602060405180830381865afa158015610e1e573d6000803e3d6000fd5b505050506040513d601f19601f82011682018060405250810190610e429190613cd2565b6040516001600160e01b031960e085901b1681526001600160a01b0392831660048201529082166024820152604481018690526064810185905260006084820181905260a482015290871660c48201524260e4820152610104016060604051808303816000875af1158015610ebb573d6000803e3d6000fd5b505050506040513d601f19601f82011682018060405250810190610edf9190613d4e565b50505050505050505050565b6000546001600160a01b03163314610f455760405162461bcd60e51b815260206004820181905260248201527f4f776e61626c653a2063616c6c6572206973206e6f7420746865206f776e657260448201526064016103d0565b6001600160a01b03166000908152600460205260409020805460ff19166001179055565b610f7e6001600160a01b0385163330866117b5565b610f88848361183b565b610f94848483856123ed565b5050505050565b600080846001600160a01b0316630dfe16816040518163ffffffff1660e01b8152600401602060405180830381865afa158015610fdc573d6000803e3d6000fd5b505050506040513d601f19601f820116820180604052508101906110009190613cd2565b6001600160a01b0316866001600160a01b031614806110915750846001600160a01b031663d21220a76040518163ffffffff1660e01b8152600401602060405180830381865afa158015611058573d6000803e3d6000fd5b505050506040513d601f19601f8201168201806040525081019061107c9190613cd2565b6001600160a01b0316866001600160a01b0316145b1561128d576000856001600160a01b0316630dfe16816040518163ffffffff1660e01b8152600401602060405180830381865afa1580156110d6573d6000803e3d6000fd5b505050506040513d601f19601f820116820180604052508101906110fa9190613cd2565b6001600160a01b0316876001600160a01b03161461117957856001600160a01b0316630dfe16816040518163ffffffff1660e01b8152600401602060405180830381865afa158015611150573d6000803e3d6000fd5b505050506040513d601f19601f820116820180604052508101906111749190613cd2565b6111db565b856001600160a01b031663d21220a76040518163ffffffff1660e01b8152600401602060405180830381865afa1580156111b7573d6000803e3d6000fd5b505050506040513d601f19601f820116820180604052508101906111db9190613cd2565b905060006111ea856002612823565b905060006111fa8983858a61282f565b9050876001600160a01b0316630dfe16816040518163ffffffff1660e01b8152600401602060405180830381865afa15801561123a573d6000803e3d6000fd5b505050506040513d601f19601f8201168201806040525081019061125e9190613cd2565b6001600160a01b0316896001600160a01b0316036112825790935091506114f79050565b935091506114f79050565b6001546000906001600160a01b038881169116146112c4576001546112bf90889086906001600160a01b03168861282f565b6112c6565b835b9050856001600160a01b0316630dfe16816040518163ffffffff1660e01b8152600401602060405180830381865afa158015611306573d6000803e3d6000fd5b505050506040513d601f19601f8201168201806040525081019061132a9190613cd2565b6001546001600160a01b039182169116036113d75761134a816002612823565b6001546113cd906001600160a01b0316611365846002612823565b896001600160a01b031663d21220a76040518163ffffffff1660e01b8152600401602060405180830381865afa1580156113a3573d6000803e3d6000fd5b505050506040513d601f19601f820116820180604052508101906113c79190613cd2565b8961282f565b92509250506114f7565b856001600160a01b031663d21220a76040518163ffffffff1660e01b8152600401602060405180830381865afa158015611415573d6000803e3d6000fd5b505050506040513d601f19601f820116820180604052508101906114399190613cd2565b6001546001600160a01b039182169116036114dc576001546114d1906001600160a01b0316611469836002612823565b886001600160a01b0316630dfe16816040518163ffffffff1660e01b8152600401602060405180830381865afa1580156114a7573d6000803e3d6000fd5b505050506040513d601f19601f820116820180604052508101906114cb9190613cd2565b8861282f565b6113cd826002612823565b60015461134a906001600160a01b0316611469836002612823565b94509492505050565b6115156001600160a01b0386163330876117b5565b61151f858361183b565b610b4d85858584866118c8565b611536858361183b565b6001600160a01b03851660009081526003602052604090205460ff161561164b576040516323b872dd60e01b8152336004820152306024820152604481018590526001600160a01b038616906323b872dd906064016020604051808303816000875af11580156115aa573d6000803e3d6000fd5b505050506040513d601f19601f820116820180604052508101906115ce9190613d2c565b506040516370a0823160e01b81523060048201526116459086906001600160a01b038216906370a0823190602401602060405180830381865afa158015611619573d6000803e3d6000fd5b505050506040513d601f19601f8201168201806040525081019061163d9190613d13565b858486612f96565b50610f94565b6116606001600160a01b0386163330876117b5565b61166a858361183b565b6116458585858486612f96565b6000546001600160a01b031633146116d15760405162461bcd60e51b815260206004820181905260248201527f4f776e61626c653a2063616c6c6572206973206e6f7420746865206f776e657260448201526064016103d0565b6001600160a01b03811661174d5760405162461bcd60e51b815260206004820152602660248201527f4f776e61626c653a206e6577206f776e657220697320746865207a65726f206160448201527f646472657373000000000000000000000000000000000000000000000000000060648201526084016103d0565b600080546040516001600160a01b03808516939216917f8be0079c531659141344cd1fd0a4f28419497f9722a3daafe3b4186f6b6457e091a36000805473ffffffffffffffffffffffffffffffffffffffff19166001600160a01b0392909216919091179055565b6040516001600160a01b03808516602483015283166044820152606481018290526118359085906323b872dd60e01b906084015b60408051601f198184030181529190526020810180517bffffffffffffffffffffffffffffffffffffffffffffffffffffffff166001600160e01b0319909316929092179091526132eb565b50505050565b604051636eb1769f60e11b81523060048201526001600160a01b03828116602483015283169063dd62ed3e90604401602060405180830381865afa158015611887573d6000803e3d6000fd5b505050506040513d601f19601f820116820180604052508101906118ab9190613d13565b6000036106d4576106d46001600160a01b038316826000196133d0565b6001600160a01b0380861660009081526002602081815260408084208587168086529083528185205489871686529383528185209085529091528220549192849291811691166060821580159061192757506001600160a01b03821615155b15611b0957816001600160a01b0316836001600160a01b031614611a6c5760408051600580825260c08201909252906020820160a080368337019050509050898160008151811061197a5761197a613d92565b60200260200101906001600160a01b031690816001600160a01b03168152505082816001815181106119ae576119ae613d92565b6001600160a01b0392831660209182029290920101526001548251911690829060029081106119df576119df613d92565b60200260200101906001600160a01b031690816001600160a01b0316815250508181600381518110611a1357611a13613d92565b60200260200101906001600160a01b031690816001600160a01b0316815250508781600481518110611a4757611a47613d92565b60200260200101906001600160a01b031690816001600160a01b031681525050611f68565b6040805160038082526080820190925290602082016060803683370190505090508981600081518110611aa157611aa1613d92565b60200260200101906001600160a01b031690816001600160a01b0316815250508281600181518110611ad557611ad5613d92565b60200260200101906001600160a01b031690816001600160a01b0316815250508781600281518110611a4757611a47613d92565b6001600160a01b03831615611d2657876001600160a01b0316836001600160a01b031603611ba85760025b604051908082528060200260200182016040528015611b5d578160200160208202803683370190505b5090508981600081518110611b7457611b74613d92565b60200260200101906001600160a01b031690816001600160a01b0316815250508781600181518110611a4757611a47613d92565b6001546001600160a01b0390811690891603611c58576040805160038082526080820190925290602082016060803683370190505090508981600081518110611bf357611bf3613d92565b60200260200101906001600160a01b031690816001600160a01b0316815250508281600181518110611c2757611c27613d92565b6001600160a01b039283166020918202929092010152600154825191169082906002908110611a4757611a47613d92565b60408051600480825260a0820190925290602082016080803683370190505090508981600081518110611c8d57611c8d613d92565b60200260200101906001600160a01b031690816001600160a01b0316815250508281600181518110611cc157611cc1613d92565b6001600160a01b039283166020918202929092010152600154825191169082906002908110611cf257611cf2613d92565b60200260200101906001600160a01b031690816001600160a01b0316815250508781600381518110611a4757611a47613d92565b6001600160a01b03821615611e7957816001600160a01b03168a6001600160a01b031603611d55576002611b34565b6001546001600160a01b03908116908b1603611de057604080516003808252608082019092529060208201606080368337505060015482519293506001600160a01b031691839150600090611dac57611dac613d92565b60200260200101906001600160a01b031690816001600160a01b0316815250508181600181518110611ad557611ad5613d92565b60408051600480825260a0820190925290602082016080803683370190505090508981600081518110611e1557611e15613d92565b6001600160a01b0392831660209182029290920101526001805483519216918391908110611e4557611e45613d92565b60200260200101906001600160a01b031690816001600160a01b0316815250508181600281518110611cf257611cf2613d92565b6001546001600160a01b038b811691161480611ea257506001546001600160a01b038981169116145b15611eae576002611b34565b6040805160038082526080820190925290602082016060803683370190505090508981600081518110611ee357611ee3613d92565b6001600160a01b0392831660209182029290920101526001805483519216918391908110611f1357611f13613d92565b60200260200101906001600160a01b031690816001600160a01b0316815250508781600281518110611f4757611f47613d92565b60200260200101906001600160a01b031690816001600160a01b0316815250505b6001600160a01b038a1660009081526003602052604090205460609060ff1615612080576040517f5c11d7950000000000000000000000000000000000000000000000000000000081526001600160a01b03861690635c11d79590611fda908d9060009087908e904290600401613dec565b600060405180830381600087803b158015611ff457600080fd5b505af1158015612008573d6000803e3d6000fd5b50506040516370a0823160e01b81523060048201526001600160a01b038c1692506370a082319150602401602060405180830381865afa158015612050573d6000803e3d6000fd5b505050506040513d601f19601f820116820180604052508101906120749190613d13565b95505050505050612146565b6040517f38ed17390000000000000000000000000000000000000000000000000000000081526001600160a01b038616906338ed1739906120ce908d9060009087908e904290600401613dec565b6000604051808303816000875af11580156120ed573d6000803e3d6000fd5b505050506040513d6000823e601f3d908101601f191682016040526121159190810190613e28565b905080600182516121269190613efc565b8151811061213657612136613d92565b6020026020010151955050505050505b95945050505050565b600061215b8284613f0f565b90505b92915050565b6040516001600160a01b03831660248201526044810182905261062d9084907fa9059cbb00000000000000000000000000000000000000000000000000000000906064016117e9565b6000808590506000816001600160a01b0316630dfe16816040518163ffffffff1660e01b8152600401602060405180830381865afa1580156121f3573d6000803e3d6000fd5b505050506040513d601f19601f820116820180604052508101906122179190613cd2565b90506000826001600160a01b031663d21220a76040518163ffffffff1660e01b8152600401602060405180830381865afa158015612259573d6000803e3d6000fd5b505050506040513d601f19601f8201168201806040525081019061227d9190613cd2565b6001549091506000906001600160a01b03848116911614806122ac57506001546001600160a01b038381169116145b156122ea576001546000906001600160a01b038581169116146122cf57836122d1565b825b90506122df818a898b613505565b93506122fc92505050565b6122f783838a898b61362a565b925050505b93505050505b949350505050565b604080516000808252602082019092526001600160a01b0384169083906040516123349190613f46565b60006040518083038185875af1925050503d8060008114612371576040519150601f19603f3d011682016040523d82523d6000602084013e612376565b606091505b505090508061062d5760405162461bcd60e51b815260206004820152602360248201527f5472616e7366657248656c7065723a204554485f5452414e534645525f46414960448201527f4c4544000000000000000000000000000000000000000000000000000000000060648201526084016103d0565b6001600160a01b038481166000908152600260209081526040808320848616845290915281205490916060918491161561255d57604080516003808252608082019092529060208201606080368337019050509150868260008151811061245657612456613d92565b6001600160a01b039283166020918202929092018101919091528882166000908152600282526040808220888516835290925220548351911690839060019081106124a3576124a3613d92565b60200260200101906001600160a01b031690816001600160a01b031681525050806001600160a01b031663ad5c46486040518163ffffffff1660e01b8152600401602060405180830381865afa158015612501573d6000803e3d6000fd5b505050506040513d601f19601f820116820180604052508101906125259190613cd2565b8260028151811061253857612538613d92565b60200260200101906001600160a01b031690816001600160a01b031681525050612647565b6040805160028082526060820183529091602083019080368337019050509150868260008151811061259157612591613d92565b60200260200101906001600160a01b031690816001600160a01b031681525050806001600160a01b031663ad5c46486040518163ffffffff1660e01b8152600401602060405180830381865afa1580156125ef573d6000803e3d6000fd5b505050506040513d601f19601f820116820180604052508101906126139190613cd2565b8260018151811061262657612626613d92565b60200260200101906001600160a01b031690816001600160a01b0316815250505b6001600160a01b03871660009081526003602052604090205460ff1615612759576040517f791ac9470000000000000000000000000000000000000000000000000000000081526001600160a01b0382169063791ac947906126b690899060009087908b904290600401613dec565b600060405180830381600087803b1580156126d057600080fd5b505af11580156126e4573d6000803e3d6000fd5b50506040516370a0823160e01b81523060048201526001600160a01b038a1692506370a082319150602401602060405180830381865afa15801561272c573d6000803e3d6000fd5b505050506040513d601f19601f820116820180604052508101906127509190613d13565b92505050612302565b6040517f18cbafe50000000000000000000000000000000000000000000000000000000081526000906001600160a01b038316906318cbafe5906127a9908a90859088908c904290600401613dec565b6000604051808303816000875af11580156127c8573d6000803e3d6000fd5b505050506040513d6000823e601f3d908101601f191682016040526127f09190810190613e28565b905080600182516128019190613efc565b8151811061281157612811613d92565b60200260200101519350505050612302565b600061215b8284613f62565b6001600160a01b0380851660009081526002602081815260408084208587168086529083528185205488871686529383528185209085529091528220549192849291811691166060821580159061288e57506001600160a01b03821615155b15612a7057816001600160a01b0316836001600160a01b0316146129d35760408051600580825260c08201909252906020820160a08036833701905050905088816000815181106128e1576128e1613d92565b60200260200101906001600160a01b031690816001600160a01b031681525050828160018151811061291557612915613d92565b6001600160a01b03928316602091820292909201015260015482519116908290600290811061294657612946613d92565b60200260200101906001600160a01b031690816001600160a01b031681525050818160038151811061297a5761297a613d92565b60200260200101906001600160a01b031690816001600160a01b03168152505086816004815181106129ae576129ae613d92565b60200260200101906001600160a01b031690816001600160a01b031681525050612ecf565b6040805160038082526080820190925290602082016060803683370190505090508881600081518110612a0857612a08613d92565b60200260200101906001600160a01b031690816001600160a01b0316815250508281600181518110612a3c57612a3c613d92565b60200260200101906001600160a01b031690816001600160a01b03168152505086816002815181106129ae576129ae613d92565b6001600160a01b03831615612c8d57866001600160a01b0316836001600160a01b031603612b0f5760025b604051908082528060200260200182016040528015612ac4578160200160208202803683370190505b5090508881600081518110612adb57612adb613d92565b60200260200101906001600160a01b031690816001600160a01b03168152505086816001815181106129ae576129ae613d92565b6001546001600160a01b0390811690881603612bbf576040805160038082526080820190925290602082016060803683370190505090508881600081518110612b5a57612b5a613d92565b60200260200101906001600160a01b031690816001600160a01b0316815250508281600181518110612b8e57612b8e613d92565b6001600160a01b0392831660209182029290920101526001548251911690829060029081106129ae576129ae613d92565b60408051600480825260a0820190925290602082016080803683370190505090508881600081518110612bf457612bf4613d92565b60200260200101906001600160a01b031690816001600160a01b0316815250508281600181518110612c2857612c28613d92565b6001600160a01b039283166020918202929092010152600154825191169082906002908110612c5957612c59613d92565b60200260200101906001600160a01b031690816001600160a01b03168152505086816003815181106129ae576129ae613d92565b6001600160a01b03821615612de057816001600160a01b0316896001600160a01b031603612cbc576002612a9b565b6001546001600160a01b03908116908a1603612d4757604080516003808252608082019092529060208201606080368337505060015482519293506001600160a01b031691839150600090612d1357612d13613d92565b60200260200101906001600160a01b031690816001600160a01b0316815250508181600181518110612a3c57612a3c613d92565b60408051600480825260a0820190925290602082016080803683370190505090508881600081518110612d7c57612d7c613d92565b6001600160a01b0392831660209182029290920101526001805483519216918391908110612dac57612dac613d92565b60200260200101906001600160a01b031690816001600160a01b0316815250508181600281518110612c5957612c59613d92565b6001546001600160a01b038a811691161480612e0957506001546001600160a01b038881169116145b15612e15576002612a9b565b6040805160038082526080820190925290602082016060803683370190505090508881600081518110612e4a57612e4a613d92565b6001600160a01b0392831660209182029290920101526001805483519216918391908110612e7a57612e7a613d92565b60200260200101906001600160a01b031690816001600160a01b0316815250508681600281518110612eae57612eae613d92565b60200260200101906001600160a01b031690816001600160a01b0316815250505b6040517fd06ca61f0000000000000000000000000000000000000000000000000000000081526000906001600160a01b0386169063d06ca61f90612f19908c908690600401613f84565b600060405180830381865afa158015612f36573d6000803e3d6000fd5b505050506040513d6000823e601f3d908101601f19168201604052612f5e9190810190613e28565b90508060018251612f6f9190613efc565b81518110612f7f57612f7f613d92565b602002602001015195505050505050949350505050565b6000836001600160a01b0316630dfe16816040518163ffffffff1660e01b8152600401602060405180830381865afa158015612fd6573d6000803e3d6000fd5b505050506040513d601f19601f82011682018060405250810190612ffa9190613cd2565b6001600160a01b0316866001600160a01b0316148061308b5750836001600160a01b031663d21220a76040518163ffffffff1660e01b8152600401602060405180830381865afa158015613052573d6000803e3d6000fd5b505050506040513d601f19601f820116820180604052508101906130769190613cd2565b6001600160a01b0316866001600160a01b0316145b156132c7576000846001600160a01b0316630dfe16816040518163ffffffff1660e01b8152600401602060405180830381865afa1580156130d0573d6000803e3d6000fd5b505050506040513d601f19601f820116820180604052508101906130f49190613cd2565b6001600160a01b0316876001600160a01b03161461317357846001600160a01b0316630dfe16816040518163ffffffff1660e01b8152600401602060405180830381865afa15801561314a573d6000803e3d6000fd5b505050506040513d601f19601f8201168201806040525081019061316e9190613cd2565b6131d5565b846001600160a01b031663d21220a76040518163ffffffff1660e01b8152600401602060405180830381865afa1580156131b1573d6000803e3d6000fd5b505050506040513d601f19601f820116820180604052508101906131d59190613cd2565b90506131e1818461183b565b60006131ee876002612823565b905060006131ff89838530896118c8565b905060006001600160a01b03861663e8e337008b8661321e8d88613749565b6040516001600160e01b031960e086901b1681526001600160a01b039384166004820152918316602483015260448201526064810186905260006084820181905260a4820152908a1660c48201524260e4820152610104016060604051808303816000875af1158015613295573d6000803e3d6000fd5b505050506040513d601f19601f820116820180604052508101906132b99190613d4e565b965061214695505050505050565b60006132d5878730866123ed565b90506132e3858286866121ad565b915050612146565b6000613340826040518060400160405280602081526020017f5361666545524332303a206c6f772d6c6576656c2063616c6c206661696c6564815250856001600160a01b03166137559092919063ffffffff16565b80519091501561062d578080602001905181019061335e9190613d2c565b61062d5760405162461bcd60e51b815260206004820152602a60248201527f5361666545524332303a204552433230206f7065726174696f6e20646964206e60448201527f6f7420737563636565640000000000000000000000000000000000000000000060648201526084016103d0565b80158061344a5750604051636eb1769f60e11b81523060048201526001600160a01b03838116602483015284169063dd62ed3e90604401602060405180830381865afa158015613424573d6000803e3d6000fd5b505050506040513d601f19601f820116820180604052508101906134489190613d13565b155b6134bc5760405162461bcd60e51b815260206004820152603660248201527f5361666545524332303a20617070726f76652066726f6d206e6f6e2d7a65726f60448201527f20746f206e6f6e2d7a65726f20616c6c6f77616e63650000000000000000000060648201526084016103d0565b6040516001600160a01b03831660248201526044810182905261062d9084907f095ea7b300000000000000000000000000000000000000000000000000000000906064016117e9565b6000808080613515876002612823565b905060006135258983308a61376e565b9050613531898861183b565b6001600160a01b03871660009081526004602052604090205460ff161561360657866001600160a01b03811663d427d12c61356c8b86613749565b6040516001600160e01b031960e084901b1681526001600160a01b03808f1660048301526024820187905260006044830181905260648301528b1660848201524260a482015260c40160606040518083038185885af11580156135d3573d6000803e3d6000fd5b50505050506040513d601f19601f820116820180604052508101906135f89190613d4e565b955095509550505050613620565b866001600160a01b03811663f305d71961356c8b86613749565b9450945094915050565b600080808061363a876002612823565b9050600061364a8a83308a61376e565b905060006136638a61365c8b86613749565b308b61376e565b905061366f8b8961183b565b6136798a8961183b565b6040517fe8e337000000000000000000000000000000000000000000000000000000000081526001600160a01b038c811660048301528b81166024830152604482018490526064820183905260006084830181905260a483015288811660c48301524260e483015289919082169063e8e3370090610104016060604051808303816000875af1158015613710573d6000803e3d6000fd5b505050506040513d601f19601f820116820180604052508101906137349190613d4e565b96509650965050505050955095509592505050565b600061215b8284613efc565b606061376484846000856139d1565b90505b9392505050565b6001600160a01b038481166000908152600260209081526040808320848616845290915281205490916060918491161561388957604080516003808252608082019092529060208201606080368337505060015482519294506001600160a01b0316918491506000906137e3576137e3613d92565b6001600160a01b0392831660209182029290920181019190915288821660009081526002825260408082208885168352909252205483519116908390600190811061383057613830613d92565b60200260200101906001600160a01b031690816001600160a01b031681525050868260028151811061386457613864613d92565b60200260200101906001600160a01b031690816001600160a01b03168152505061391e565b6040805160028082526060820183529091602083019080368337505060015482519294506001600160a01b0316918491506000906138c9576138c9613d92565b60200260200101906001600160a01b031690816001600160a01b03168152505086826001815181106138fd576138fd613d92565b60200260200101906001600160a01b031690816001600160a01b0316815250505b6000816001600160a01b0316637ff36ab5886000868a426040518663ffffffff1660e01b81526004016139549493929190613f9d565b60006040518083038185885af1158015613972573d6000803e3d6000fd5b50505050506040513d6000823e601f3d908101601f1916820160405261399b9190810190613e28565b905080600182516139ac9190613efc565b815181106139bc576139bc613d92565b60200260200101519350505050949350505050565b606082471015613a495760405162461bcd60e51b815260206004820152602660248201527f416464726573733a20696e73756666696369656e742062616c616e636520666f60448201527f722063616c6c000000000000000000000000000000000000000000000000000060648201526084016103d0565b843b613a975760405162461bcd60e51b815260206004820152601d60248201527f416464726573733a2063616c6c20746f206e6f6e2d636f6e747261637400000060448201526064016103d0565b600080866001600160a01b03168587604051613ab39190613f46565b60006040518083038185875af1925050503d8060008114613af0576040519150601f19603f3d011682016040523d82523d6000602084013e613af5565b606091505b5091509150613b05828286613b10565b979650505050505050565b60608315613b1f575081613767565b825115613b2f5782518084602001fd5b8160405162461bcd60e51b81526004016103d09190613fd2565b6001600160a01b03811681146107d057600080fd5b600060208284031215613b7057600080fd5b813561376781613b49565b600080600080600060a08688031215613b9357600080fd5b8535613b9e81613b49565b9450602086013593506040860135613bb581613b49565b92506060860135613bc581613b49565b91506080860135613bd581613b49565b809150509295509295909350565b600080600060608486031215613bf857600080fd5b8335613c0381613b49565b92506020840135613c1381613b49565b91506040840135613c2381613b49565b809150509250925092565b60008060008060808587031215613c4457600080fd5b8435613c4f81613b49565b9350602085013592506040850135613c6681613b49565b91506060850135613c7681613b49565b939692955090935050565b60008060008060808587031215613c9757600080fd5b8435613ca281613b49565b93506020850135613cb281613b49565b92506040850135613cc281613b49565b9396929550929360600135925050565b600060208284031215613ce457600080fd5b815161376781613b49565b60008060408385031215613d0257600080fd5b505080516020909101519092909150565b600060208284031215613d2557600080fd5b5051919050565b600060208284031215613d3e57600080fd5b8151801515811461376757600080fd5b600080600060608486031215613d6357600080fd5b8351925060208401519150604084015190509250925092565b634e487b7160e01b600052604160045260246000fd5b634e487b7160e01b600052603260045260246000fd5b600081518084526020808501945080840160005b83811015613de15781516001600160a01b031687529582019590820190600101613dbc565b509495945050505050565b85815284602082015260a060408201526000613e0b60a0830186613da8565b6001600160a01b0394909416606083015250608001529392505050565b60006020808385031215613e3b57600080fd5b825167ffffffffffffffff80821115613e5357600080fd5b818501915085601f830112613e6757600080fd5b815181811115613e7957613e79613d7c565b8060051b604051601f19603f83011681018181108582111715613e9e57613e9e613d7c565b604052918252848201925083810185019188831115613ebc57600080fd5b938501935b82851015613eda57845184529385019392850192613ec1565b98975050505050505050565b634e487b7160e01b600052601160045260246000fd5b8181038181111561215e5761215e613ee6565b8082018082111561215e5761215e613ee6565b60005b83811015613f3d578181015183820152602001613f25565b50506000910152565b60008251613f58818460208701613f22565b9190910192915050565b600082613f7f57634e487b7160e01b600052601260045260246000fd5b500490565b8281526040602082015260006137646040830184613da8565b848152608060208201526000613fb66080830186613da8565b6001600160a01b03949094166040830152506060015292915050565b6020815260008251806020840152613ff1816040850160208701613f22565b601f01601f1916919091016040019291505056fea2646970667358221220057a2040832e00ee6eb37268908a286f8c6f6995f96463fcf029312be36b551a64736f6c63430008110033",
  "devdoc": {
    "kind": "dev",
    "methods": {
      "owner()": {
        "details": "Returns the address of the current owner."
      },
      "renounceOwnership()": {
        "details": "Leaves the contract without owner. It will not be possible to call `onlyOwner` functions anymore. Can only be called by the current owner. NOTE: Renouncing ownership will leave the contract without an owner, thereby removing any functionality that is only available to the owner."
      },
      "transferOwnership(address)": {
        "details": "Transfers ownership of the contract to a new account (`newOwner`). Can only be called by the current owner."
      }
    },
    "version": 1
  },
  "userdoc": {
    "kind": "user",
    "methods": {},
    "version": 1
  },
  "storageLayout": {
    "storage": [
      {
        "astId": 5869,
        "contract": "contracts/Zap.sol:Zap",
        "label": "_owner",
        "offset": 0,
        "slot": "0",
        "type": "t_address"
      },
      {
        "astId": 6081,
        "contract": "contracts/Zap.sol:Zap",
        "label": "WNATIVE",
        "offset": 0,
        "slot": "1",
        "type": "t_address"
      },
      {
        "astId": 6087,
        "contract": "contracts/Zap.sol:Zap",
        "label": "tokenBridgeForRouter",
        "offset": 0,
        "slot": "2",
        "type": "t_mapping(t_address,t_mapping(t_address,t_address))"
      },
      {
        "astId": 6091,
        "contract": "contracts/Zap.sol:Zap",
        "label": "isFeeOnTransfer",
        "offset": 0,
        "slot": "3",
        "type": "t_mapping(t_address,t_bool)"
      },
      {
        "astId": 6095,
        "contract": "contracts/Zap.sol:Zap",
        "label": "useNativeRouter",
        "offset": 0,
        "slot": "4",
        "type": "t_mapping(t_address,t_bool)"
      }
    ],
    "types": {
      "t_address": {
        "encoding": "inplace",
        "label": "address",
        "numberOfBytes": "20"
      },
      "t_bool": {
        "encoding": "inplace",
        "label": "bool",
        "numberOfBytes": "1"
      },
      "t_mapping(t_address,t_address)": {
        "encoding": "mapping",
        "key": "t_address",
        "label": "mapping(address => address)",
        "numberOfBytes": "32",
        "value": "t_address"
      },
      "t_mapping(t_address,t_bool)": {
        "encoding": "mapping",
        "key": "t_address",
        "label": "mapping(address => bool)",
        "numberOfBytes": "32",
        "value": "t_bool"
      },
      "t_mapping(t_address,t_mapping(t_address,t_address))": {
        "encoding": "mapping",
        "key": "t_address",
        "label": "mapping(address => mapping(address => address))",
        "numberOfBytes": "32",
        "value": "t_mapping(t_address,t_address)"
      }
    }
  }
}